KUngernyc,RT @altochulo: Sinai is calling voters about @jessicaramos and @CynthiaNixon because she heard first hand from them about their commitment…,Sinai is calling voters about @jessicaramos and @CynthiaNixon because she heard first hand from them about their commitment to delivering the $40M+ that NY State owes schools like hers in Senate District 13. #SchoolsnotJails https://t.co/r1OynShRyO,Sat Aug 18 20:32:09 +0000 2018
lilxdt,"My gahd, I've been hearing footsteps coming from the roof and it's starting to scare me. It's probably some cat chilling but it may be a person since the footsteps can be heard but whatever is up there is stepping carefully to be discreet",,Sat Aug 18 20:32:06 +0000 2018
SallyM32904263,"@ayeup @proud_remoaner @PhysicQuantised @vincecable @Nigel_Farage @theresa_may I am awaiting the positives of leaving the EU, apart from sounbites such as “taking back control”or “maintaining our sovereignty” I have heard not one one solution to the mass problems that leaving the EU will create.",,Sat Aug 18 20:32:04 +0000 2018
Hanny1993xxxx,"@heatherpeace Havent heard from you on twitter in ages well, everyone hasnt",,Sat Aug 18 20:32:04 +0000 2018
TendresseBiebx,"RT @TheOutli3R: Heard my husband scream ""NOOOOOO!"" from across the house, ran to see if he was okay, then discovered him watching that vide…","Heard my husband scream ""NOOOOOO!"" from across the house, ran to see if he was okay, then discovered him watching that video of the raccoon who tries to ""wash"" his cotton candy and then appear visibly upset when it dissolves in the water.",Sat Aug 18 20:32:03 +0000 2018
Craillsy,@stephenottley @Bradders3078 Haha I heard about this from DJ.. my response is that you should have come in!!,,Sat Aug 18 20:31:56 +0000 2018
Nisha99_,"RT @iqaafatty99: @wxnia Yes sis I heard that from a scholar too, that it’s been influenced by the hindus and old African traditions too in…","@wxnia Yes sis I heard that from a scholar too, that it’s been influenced by the hindus and old African traditions too in some cases",Sat Aug 18 20:31:56 +0000 2018
SergeGagne3,@RudyGiuliani Time for you to go on a cruise. They can then throw you overboard. Never to be seen or heard from again.,,Sat Aug 18 20:31:56 +0000 2018
PeckinsMatt,@RedskinsRD21 @LetsTalkSkins @chrisdbryant1 I hadn't heard really any good things from Cam Sims all camp. But what do you know he balls when he gets the opportunity,,Sat Aug 18 20:31:55 +0000 2018
MKGenest,"@Omega40 I've heard it from many different people since I made a tweet about him last night. I've seen screen shots of what was said.. It is true, unfortunately.",,Sat Aug 18 20:31:51 +0000 2018
GraphicMedicine,"RT @NoetheMatt: I've heard a number of people say things like ""sneaking in"" to @GraphicMedicine because they are new and learning. I want t…","I've heard a number of people say things like ""sneaking in"" to @GraphicMedicine because they are new and learning. I want to discourage that language! We are *all* learning from each other, all of the time. Your perspective helps us grow and do better! #GraphicMedicine18",Sat Aug 18 20:31:51 +0000 2018
eleanorboyce,"RT @BethDarnall: If you have chronic pain, you may have heard people say ""it's all in your head.""
Nothing could be further from the truth.…","If you have chronic pain, you may have heard people say ""it's all in your head.""
Nothing could be further from the truth. Your #pain is REAL.

Help spread this message by retweeting!

#YourPainIsReal",Sat Aug 18 20:31:41 +0000 2018
TessEBoyle,"RT @MissingKids: Have you seen this child? ERIN POSPISIL

Erin's photo is shown age-progressed to 29 years. She was last seen at home on Ju…","Have you seen this child? ERIN POSPISIL

Erin's photo is shown age-progressed to 29 years. She was last seen at home on June 3, 2001 in Cedar Rapids, IA and she has not been seen or heard from since that day. #PictureThemHome 

https://t.co/YA15udyBHo",Sat Aug 18 20:31:41 +0000 2018
gracepilett,"RT @TheOutli3R: Heard my husband scream ""NOOOOOO!"" from across the house, ran to see if he was okay, then discovered him watching that vide…","Heard my husband scream ""NOOOOOO!"" from across the house, ran to see if he was okay, then discovered him watching that video of the raccoon who tries to ""wash"" his cotton candy and then appear visibly upset when it dissolves in the water.",Sat Aug 18 20:31:38 +0000 2018
noralove,"RT @GothamGirlBlue: Because in order for this #resistance thing to work out, the power can’t come from converts alone. It has to come from…","Because in order for this #resistance thing to work out, the power can’t come from converts alone. It has to come from the people who weren’t being heard the entire time. And Amy is sitting right in the middle of a credibility gap.",Sat Aug 18 20:31:34 +0000 2018
DJC23753532,@SoulStealer25 ROFL! Yeah that sounds about right from what I've heard about him. He takes shit very personally. Consider yourself lucky he could have given you a redshirt and sent you on a landing party https://t.co/ztKmYdw8Fj,,Sat Aug 18 20:31:33 +0000 2018
Therealjackbau4,@tomorrowmanx @ChadBarbour1 @nytimes That is the most retared logic I’ve ever heard. She grew up in the suburbs and has never had hardship in her life. Kids have been caged since 2004 obama never stopped it either. Also the kids aren’t in cages those pictures are from obama as well. They are housed in a Walmart,,Sat Aug 18 20:31:27 +0000 2018
frydclt,RT @ProudAm5: @vinodArichella @pinokole Not false propaganda at all. Americans are fighting to take their country back from globalists. Who…,@vinodArichella @pinokole Not false propaganda at all. Americans are fighting to take their country back from globalists. Who has more right to be heard in America..foreigners on work visas already taking our jobs and trying to monopolize GC or Americans?,Sat Aug 18 20:31:11 +0000 2018
arianag0622,"RT @TheOutli3R: Heard my husband scream ""NOOOOOO!"" from across the house, ran to see if he was okay, then discovered him watching that vide…","Heard my husband scream ""NOOOOOO!"" from across the house, ran to see if he was okay, then discovered him watching that video of the raccoon who tries to ""wash"" his cotton candy and then appear visibly upset when it dissolves in the water.",Sat Aug 18 20:31:04 +0000 2018
my_ungjun,RT @chaehungwon: I heard from kmbb that all of Monsta x kissed the floor when they arrived to S Korea and that Minhyuk yelled victory scree…,I heard from kmbb that all of Monsta x kissed the floor when they arrived to S Korea and that Minhyuk yelled victory screech followed by the rest of Monsta x yodeling,Sat Aug 18 20:31:02 +0000 2018
krose1117,"RT @MissingKids: Have you seen this child? ERIN POSPISIL

Erin's photo is shown age-progressed to 29 years. She was last seen at home on Ju…","Have you seen this child? ERIN POSPISIL

Erin's photo is shown age-progressed to 29 years. She was last seen at home on June 3, 2001 in Cedar Rapids, IA and she has not been seen or heard from since that day. #PictureThemHome 

https://t.co/YA15udyBHo",Sat Aug 18 20:31:00 +0000 2018
CCuk76,"RT @Suzagooner: @GoonerH95 @CCuk76 @Arsenal Always positive Henri. Where have you been,first time I heard from you for ages.😘","@GoonerH95 @CCuk76 @Arsenal Always positive Henri. Where have you been,first time I heard from you for ages.😘",Sat Aug 18 20:30:58 +0000 2018
Classy_joe,"RT @eastsportsman: Just heard ""Woara"" for the first time and I'm told it's by Kwasi Arthur. Kid is not letting up from that sizzling freshm…","Just heard ""Woara"" for the first time and I'm told it's by Kwasi Arthur. Kid is not letting up from that sizzling freshman year koraaa.",Sat Aug 18 20:30:44 +0000 2018
emtfr,"RT @emtfr: @OSU_Marine @ScottMagruder1 @bobbybarstool @Brett_McMurphy @WatchStadium @barstoolsports @Deadspin So this fake ""troller account…","@OSU_Marine @ScottMagruder1 @bobbybarstool @Brett_McMurphy @WatchStadium @barstoolsports @Deadspin So this fake ""troller account"" calling me OSU epithets doesn't bother me.  I've heard worse for  fact-telling. These sports reporters PURPOSELY distract public from any serious community predator case they can't connect to ""🏈"" by trying to make up 🏈 stories about said school.",Sat Aug 18 20:30:40 +0000 2018
angieloves_food,Lol my coworker lives two blocks away from me and I had to ask if he heard the gunshots last night,,Sat Aug 18 20:30:34 +0000 2018
GregWeisheipl,"RT @di_plora: Making America Great Again is voting people like you, who hate America &amp; its Middle Class, TH out of office. Quit projecting…","Making America Great Again is voting people like you, who hate America &amp; its Middle Class, TH out of office. Quit projecting your values onto my @POTUS &amp; bug off. America heard you clearly. You spoke from your black heart &amp; meant it. You can't walk it back 

#WalkAway https://t.co/JaRO90GXuY",Sat Aug 18 20:30:32 +0000 2018
LauraForczyk,@jcopella I've never heard of that. But I do my best to stay away from conspiracy theories and fringe science.,,Sat Aug 18 20:30:32 +0000 2018
deppforyou,RT @itfansofdepp: #WeBelieveInYouJohnny https://t.co/byhB9LcW9O,#WeBelieveInYouJohnny https://t.co/byhB9LcW9O,Sat Aug 18 20:30:31 +0000 2018
LindaSayle,"@KHKateHorton @DerbyChrisW And when I heard about the disciplinary, my emotional response resonated with that feeling of fear, that clearly was at the heart of what my father felt when he came to Britain.”  She is comparing getting a letter from her own Party to the fear engendered in Jews by persecution.",,Sat Aug 18 20:30:31 +0000 2018
ravenishwords,before Plutonian But --- gloated this never opened and --- his was curtain Lenore--- me the from said and Nameless door--- utters whispered more fast heard me still placid bosom's you radiant it at stern my,,Sat Aug 18 20:30:28 +0000 2018
AquafarE,"RT @XpertDemon: Despite what you heard from de Blasio about a shut down, Rikers is under full operation. The city is essentially expanding…","Despite what you heard from de Blasio about a shut down, Rikers is under full operation. The city is essentially expanding its carceral regime by building four new jail complexes in Queens, Manhattan, and Brooklyn. The full plan can be viewed here: https://t.co/7SZmb4x08o.",Sat Aug 18 20:30:25 +0000 2018
hitgreensinreg,"This is one of the dumbest statements I’ve heard you say.  You’ve become so stupid, it makes my skull hurt.  Just reading your mentions from @espngolic makes you look even more silly.  You quickly realized you couldn’t defend such an ignorant statement. https://t.co/t6nogAFMfN",,Sat Aug 18 20:30:25 +0000 2018
Blackknightrex,"RT @KevinDahmer: I've been a supporter of GamerGate from the beginning.

I haven't said much of anything about the plagiarism guy from IGN.…","I've been a supporter of GamerGate from the beginning.

I haven't said much of anything about the plagiarism guy from IGN.

Because by the time I heard about it, very shortly after it became common knowledge, IGN had already fired the guy.

Case closed.",Sat Aug 18 20:30:23 +0000 2018
frijobeans,"@Docta_JB There’s a spot not too far from you in Chinatown called full house. Good Chinese there. I’m trying to find the name of a ramen spot for you that I’ve heard good things of. Heard it’s in Little Tokyo. And idk if you’ve tried fat sals, also good",,Sat Aug 18 20:30:22 +0000 2018
fasterpussycat9,RT @abstraktnature: The reality of life as a UK carer in breach of NMWregs and the Working Time Directive. If u r a UK carer &amp; think it is…,"The reality of life as a UK carer in breach of NMWregs and the Working Time Directive. If u r a UK carer &amp; think it is immoral to be paid £3/hr when away from your family, make ur voice heard with #awakeonasleepin on FB &amp; Twitter https://t.co/faRWH3GOJP",Sat Aug 18 20:30:21 +0000 2018
kaylsmillz,"RT @TheOutli3R: Heard my husband scream ""NOOOOOO!"" from across the house, ran to see if he was okay, then discovered him watching that vide…","Heard my husband scream ""NOOOOOO!"" from across the house, ran to see if he was okay, then discovered him watching that video of the raccoon who tries to ""wash"" his cotton candy and then appear visibly upset when it dissolves in the water.",Sat Aug 18 20:30:19 +0000 2018
EVrybody_talks,"RT @TheOutli3R: Heard my husband scream ""NOOOOOO!"" from across the house, ran to see if he was okay, then discovered him watching that vide…","Heard my husband scream ""NOOOOOO!"" from across the house, ran to see if he was okay, then discovered him watching that video of the raccoon who tries to ""wash"" his cotton candy and then appear visibly upset when it dissolves in the water.",Sat Aug 18 20:30:13 +0000 2018
JCAndersonLMFT,"@badmamajama91 @kica333 @BQQuinn Some times, but mostly placed on a registry lists and probation.

Granted, as a Family Therapist i have heard a few things from various sides.  The family of the younger one, the younger person (often female), as well as the older person.

Seen success stories though as well.",,Sat Aug 18 20:30:12 +0000 2018
misskacyc,"RT @MissingKids: Have you seen this child? ERIN POSPISIL

Erin's photo is shown age-progressed to 29 years. She was last seen at home on Ju…","Have you seen this child? ERIN POSPISIL

Erin's photo is shown age-progressed to 29 years. She was last seen at home on June 3, 2001 in Cedar Rapids, IA and she has not been seen or heard from since that day. #PictureThemHome 

https://t.co/YA15udyBHo",Sat Aug 18 20:30:10 +0000 2018
RedskinsRD21,"@PeckinsMatt @LetsTalkSkins @chrisdbryant1 Rumor is he has a hamstring so you wouldn’t be able too. Regardless again it’s not just games it’s reports from Camp. Johnson has been one of the biggest standouts, what have you heard from Carter?",,Sat Aug 18 20:30:09 +0000 2018
IlaRose,RT @mkraju: Nelson told me “of course” he stands by his claims that Russians have already penetrated Florida systems. Florida officials ask…,"Nelson told me “of course” he stands by his claims that Russians have already penetrated Florida systems. Florida officials asking for more info and say they haven’t heard from him. Burr declines to comment. A week after his remarks, questions still linger https://t.co/XOMhdWKjJx",Sat Aug 18 20:30:09 +0000 2018
_Makayla13_,RT @V_sugarbaby: met a bunch of guys from Harvard yesterday and I kept pretending like I never heard of that school just to piss them off..…,"met a bunch of guys from Harvard yesterday and I kept pretending like I never heard of that school just to piss them off...one of them legit turned red when I said, “Harvard? Is that like a local community college?” LMAOOOOOO",Sat Aug 18 20:30:00 +0000 2018
IslesRealist,@ThomasBrice2017 One of the best guitar progressions I’ve ever heard. Diary of a Madman is another great one I think Jake had in mind from Randy when writing Giants. The breakdown “solo” in Giants is intense too,,Sat Aug 18 20:29:59 +0000 2018
pjatts,"RT @hfxconventions: We’re still buzzing from the good news!! 
Have you heard? Our President &amp; CEO @CCussons has been reappointed for the ne…","We’re still buzzing from the good news!! 
Have you heard? Our President &amp; CEO @CCussons has been reappointed for the next 3 years! We’re proud to have her continue leading us as we showcase Halifax Convention Centre &amp; #NovaScotia to the world. https://t.co/aHDcsqplDq https://t.co/o1bel8Igpk",Sat Aug 18 20:29:56 +0000 2018
emtfr,"@OSU_Marine @ScottMagruder1 @bobbybarstool @Brett_McMurphy @WatchStadium @barstoolsports @Deadspin So this fake ""troller account"" calling me OSU epithets doesn't bother me.  I've heard worse for  fact-telling. These sports reporters PURPOSELY distract public from any serious community predator case they can't connect to ""🏈"" by trying to make up 🏈 stories about said school.",,Sat Aug 18 20:29:38 +0000 2018
ouijababe_,RT @_MissMas: This happened to me at the West farms mall. I heard them out because I’m terrible at walking away from things like this. Afte…,This happened to me at the West farms mall. I heard them out because I’m terrible at walking away from things like this. Afterwords they kept asking for my phone number and I told them I didn’t feel comfortable and I wasn’t that interested in it... That’s scary af.. https://t.co/Y3Z5ZRUlt2,Sat Aug 18 20:29:37 +0000 2018
Jackiedepp1963,RT @itfansofdepp: #WeBelieveInYouJohnny https://t.co/byhB9LcW9O,#WeBelieveInYouJohnny https://t.co/byhB9LcW9O,Sat Aug 18 20:29:30 +0000 2018
TeeJay_W,RT @nitenightleague: @DylanBryan3 Idk what you’ve heard or you’re just a jealous fan that can’t get in but #nightniteleague is stronger tha…,@DylanBryan3 Idk what you’ve heard or you’re just a jealous fan that can’t get in but #nightniteleague is stronger than ever we have players from 10 different states playing for big grand prizes,Sat Aug 18 20:29:28 +0000 2018
mistylou43,"@Shaun12361257 @SurenSuku @DavidLammy @NinaDSchick But we have heard nothing from lammy about any of this have we, rape gangs, knife crime, terror attacks",,Sat Aug 18 20:29:21 +0000 2018
SusanSumma,"RT @LysaTerKeurst: ""So we must listen very carefully to the truth we have heard, or we may drift away from it."" (Hebrews 2:1, NLT)
 
May Go…","""So we must listen very carefully to the truth we have heard, or we may drift away from it."" (Hebrews 2:1, NLT)
 
May God's truth settle into every part of our hearts and transform us from the inside out.",Sat Aug 18 20:29:20 +0000 2018
TinaGatt72,"RT @WindsorEssexCAS: Heard of the Bearded Villians? They unite bearded men in a brotherhood devoted to loyalty, honor &amp; respect toward all…","Heard of the Bearded Villians? They unite bearded men in a brotherhood devoted to loyalty, honor &amp; respect toward all people, dedicated to the betterment of mankind through fraternity charity and kindness. Far from ‘villians’ these amazing folks were incredible today! Thanks! https://t.co/30l5zsy3GE",Sat Aug 18 20:29:19 +0000 2018
b140tweet,"RT @RepScottHolcomb: ""We heard all the gibberish about, you know, suppressing voters."" 
--Words from consultant recommending closing 7 of 9…","""We heard all the gibberish about, you know, suppressing voters."" 
--Words from consultant recommending closing 7 of 9 precincts in majority black county. 

Georgia county to close 7 of 9 voting precincts, civil rights attorney calls it 'voter suppression' https://t.co/QB4jMpiXYg",Sat Aug 18 20:29:16 +0000 2018
welheh,"@UnagiOtomachi i say u should!
it seems much more promising than Vocaloid 5 from what ive seen and ive heard reviews of it being very user-friendly for an initial release compared to other softwares
also im downloading it to try it out now too",,Sat Aug 18 20:29:11 +0000 2018
lifeofsarraa,"Lara Jean &amp; Peter Kavinsky ladies and gentlemen from “to all the boys I’ve loved before “ :))))))) ..... who df was Gen ? never heard of her 

#toalltheboysilovedbefore https://t.co/pnhbYUx91r",,Sat Aug 18 20:29:07 +0000 2018
CMjomani,RT @NwaNyango: We have all heard of one of the things that SA artists complain about... not being recognized at home. We find they receive…,We have all heard of one of the things that SA artists complain about... not being recognized at home. We find they receive so much love from other countries and not so much from their own… https://t.co/j9AS2BHM3G,Sat Aug 18 20:29:01 +0000 2018
jongobravin,"At such crucial times, you will hear from the U.K, U.S and E.U but never from China. I've never heard China condemn any evil by a despot against his own people. #FreeBobiWine https://t.co/qsTkrqAXBY",,Sat Aug 18 20:29:01 +0000 2018
sashaglmt,"Have your heard? 
Our songbooks have been updated with beautiful artwork from Jamie Kim https://t.co/zkyekK3TKt. When you join us this fall, the songbook is yours to take home and explore; encouraging your child's spiral of learning! #Guelph #Kitchener #WaterlooRegion https://t.co/JuMFEMSRXN",,Sat Aug 18 20:28:52 +0000 2018
VocanPYoshi,@honeybeehime_ glaring noises that can be heard from halfway across the country,,Sat Aug 18 20:28:50 +0000 2018
blackbird9_9,@HistoryReviewed The first I heard of this document was from WWII Researcher and Radio Host Miss Deanna Spingola several years ago.  It made quite the stir when it was released circa 2013.  I've never seen anyone prove it to NOT be an authentic Declassified FBI Document https://t.co/cFN9tjAr8A,,Sat Aug 18 20:28:48 +0000 2018
smileyface694,RT @GrahameLucas: Today in a cafe I heard a customer verbally abusing the waitress because he didn‘t like the way she said *good morning* t…,Today in a cafe I heard a customer verbally abusing the waitress because he didn‘t like the way she said *good morning* to him. He mimicked her accent repeatedly before being ushered out by the owner. She is from Eastern Europe. What kind of country have we become? I am ashamed https://t.co/nUPA6h4pbN,Sat Aug 18 20:28:44 +0000 2018
TENPIN218,RT @Music__Mentor: Some of my favorite music is from when I grew up in the '80s. The options in this 'multi-month poll' initiative are my f…,"Some of my favorite music is from when I grew up in the '80s. The options in this 'multi-month poll' initiative are my favorites from this decade.  These songs are also recommendations.  No one has heard it all.  I hope that you try, then buy - some of them.
#Awesome80sPoll  RT",Sat Aug 18 20:28:40 +0000 2018
jrp_leaf,"I could be totally wrong, but I don't think it works that way.....? People get killed from watching movies the last time I heard.. like last year. https://t.co/oOFZ4vJXZT",,Sat Aug 18 20:28:37 +0000 2018
NancyisyDepp,RT @itfansofdepp: #WeBelieveInYouJohnny https://t.co/byhB9LcW9O,#WeBelieveInYouJohnny https://t.co/byhB9LcW9O,Sat Aug 18 20:28:18 +0000 2018
RobertaBuchan1,"I heard your words from the heart. I was moved by them, esp about the planned ID numbers + police checks on children of EU residents. I am ashamed for my country that we stoop to this. As a no-vote in indyref, the question of your stance didn’t cross my mind #sidebyside4EU https://t.co/QzRhJ9cAMp",,Sat Aug 18 20:28:18 +0000 2018
cashyyylo,“I haven’t heard from u inna min”,,Sat Aug 18 20:28:12 +0000 2018
NsikeleloG,"RT @EMubuntu: You can hear 3 episodes (6pm, 7pm and 8pm) from the recent #GirlDialogue event featuring the launch of @ThubaMsweli book, Fro…","You can hear 3 episodes (6pm, 7pm and 8pm) from the recent #GirlDialogue event featuring the launch of @ThubaMsweli book, From Ashes to Beauty. Thanks to @mbonambi_linda  and for promoting @IamMbusoZA @terrymartinw @HlubiBeeza podcast can be heard here: https://t.co/FBaOn7ZxsV",Sat Aug 18 20:28:00 +0000 2018
BigRedShines69,"RT @MissingKids: Have you seen this child? ERIN POSPISIL

Erin's photo is shown age-progressed to 29 years. She was last seen at home on Ju…","Have you seen this child? ERIN POSPISIL

Erin's photo is shown age-progressed to 29 years. She was last seen at home on June 3, 2001 in Cedar Rapids, IA and she has not been seen or heard from since that day. #PictureThemHome 

https://t.co/YA15udyBHo",Sat Aug 18 20:27:59 +0000 2018
mmiller_ms,"RT @peterhreynolds: Thanks to all Dot fans who followed thru on the @Target #GoldenTicket Challenge! If u didn’t make it this time, no worr…","Thanks to all Dot fans who followed thru on the @Target #GoldenTicket Challenge! If u didn’t make it this time, no worries - I’ll do this again. If u posted a pic &amp; have NOT heard from me, please tweet/DM me ASAP so I can add you to the list - don't want to miss anyone!""❤️ https://t.co/F9enK4Qway",Sat Aug 18 20:27:58 +0000 2018
itfansofdepp,#WeBelieveInYouJohnny https://t.co/byhB9LcW9O,,Sat Aug 18 20:27:57 +0000 2018
Tapiwagomo,"RT @JustinTBrady: Reports of the Secretary-General are a conglomeration of inputs from different Departments, Offices &amp; Missions depending…","Reports of the Secretary-General are a conglomeration of inputs from different Departments, Offices &amp; Missions depending on the subject. Whenever I was tasked w/ providing such input when Kofi Annan was the SG it was a breeze because I heard his voice in my head. RIP @KofiAnnan",Sat Aug 18 20:27:56 +0000 2018
amitsorathi1,@OfficeOfNG @nitin_gadkari The costal highway has been incomplete and the construction in palghar region hasn't been completed though it has been completed In Gujarat region and it has been heard from sources the actual map has been altered to benefit the builders please look,,Sat Aug 18 20:27:39 +0000 2018
alishaavfc,RT @_megankiely: When i was 5 i locked my brother in the boot of my dads car then when asked where he’d gone i told my parents i didnt know…,When i was 5 i locked my brother in the boot of my dads car then when asked where he’d gone i told my parents i didnt know where he was. they searched the house for him n eventually went outside and heard screaming coming from the boot lol https://t.co/1cRLtYoc7l,Sat Aug 18 20:27:38 +0000 2018
policoncan,Good day @GlenMotz . I still haven't heard from you about when we are going to have a meeting on the subject of you being a child abuser . @JustinTrudeau @AndrewScheer @PatKelly_MP @MPicardLiberal @BevShipleyMP @CTV @CTVNationalNews @PnPCBC @CBCPolitics,,Sat Aug 18 20:27:36 +0000 2018
anaskifa,"RT @HatindersinghR: Meet Soberan A Vegetable Vendor From Assam,While Returning Home He Heard A Baby Crying On The Heap Of Garbage.
He Decid…","Meet Soberan A Vegetable Vendor From Assam,While Returning Home He Heard A Baby Crying On The Heap Of Garbage.
He Decided To Raise Her
Jyoti  Graduated &amp; succeeded in examination of the PCS and was posted on the post of Income Tax Assistant Commissioner.

Lets Make Him Famous
1/2 https://t.co/zU5zYtQI7P",Sat Aug 18 20:27:35 +0000 2018
