kylaelena,Just heard from my sister that my mother's kidneys aren't doing so hot so now she's on kidney meds. I really need to talk to her about a will so I don't get stuck with bullshit when she kicks the bucket,,Sat Aug 18 20:54:15 +0000 2018
Youre2Deluded,@brianstelter @TonyRomm Total BS. I myself have been shadow banned a few times. Look here on Twitter alone - the majority of blue checks are liberals - why? Have you heard a case from liberals being censored yet? The head in the Dan’s approach here is professional malpractice.,,Sat Aug 18 20:54:14 +0000 2018
bamchel,RT @hanybubble: @cherylurillo @boyband_nielm @delavinkisses 1st song she heard from the 2nd album. pano? e ang Hanggang Kailan Kaya ang pau…,@cherylurillo @boyband_nielm @delavinkisses 1st song she heard from the 2nd album. pano? e ang Hanggang Kailan Kaya ang paulit ulit sa radyo?,Sat Aug 18 20:54:13 +0000 2018
mshuster09,@mizedub Is the “like this like this like this” he used on the second drop from the Clipse “when the last time you heard it like this” sample?,,Sat Aug 18 20:54:09 +0000 2018
nobrian,"RT @wrdcsc: It would be very surprising if, as a visiting priest in DC while working for a secular law firm in 2007-2009, I heard multiple…","It would be very surprising if, as a visiting priest in DC while working for a secular law firm in 2007-2009, I heard multiple attestations from credible priests about Cardinal McCarrick but no bishops in ever town did. This is what we are asked to believe.",Sat Aug 18 20:54:08 +0000 2018
Greathe21889984,"An ex boyfriend of mine that I have not heard from in month's. Decides to call me. To ask me for a favor. He had the audacity to contact me to ask...."" Can I ask you for a favor?"", and I said what?..."" He said can you marry me so I can pay less in child support?.""#LOSER",,Sat Aug 18 20:54:03 +0000 2018
Naaaataashaaaa,"@aerlingus @britishairways lost my luggage from Dublin --&gt; Manchester. Didn't have my bag for 9 WHOLE DAYS of a 2-week long European vacation... Called, filed claim), and STILL l haven't heard a word from them, nor was I compensated in any capacity while in Europe. UNREAL.",,Sat Aug 18 20:54:01 +0000 2018
MariaDe85727451,"RT @amusingjonghyun: one year ago,,, a verrryyy precious smile of jonghyun after he heard the loud cheers from the crowd when hello stage e…","one year ago,,, a verrryyy precious smile of jonghyun after he heard the loud cheers from the crowd when hello stage ended 😭😭💕 https://t.co/w7JwmBUJ7C",Sat Aug 18 20:54:01 +0000 2018
mayabi_emran,RT @Rumi_Quote: There was a dawn when my soul heard something from your soul. I drank water from your spring and felt the current take me.,There was a dawn when my soul heard something from your soul. I drank water from your spring and felt the current take me.,Sat Aug 18 20:53:58 +0000 2018
chelss999999999,RT @V_sugarbaby: met a bunch of guys from Harvard yesterday and I kept pretending like I never heard of that school just to piss them off..…,"met a bunch of guys from Harvard yesterday and I kept pretending like I never heard of that school just to piss them off...one of them legit turned red when I said, “Harvard? Is that like a local community college?” LMAOOOOOO",Sat Aug 18 20:53:55 +0000 2018
Realisticsenior,"RT @DrSherrill: @JohnWDean So, that explains why we've heard nothing from or about him for quite a log time.","@JohnWDean So, that explains why we've heard nothing from or about him for quite a log time.",Sat Aug 18 20:53:42 +0000 2018
conchi_gonzalez,"RT @MissingKids: Have you seen this child? ERIN POSPISIL

Erin's photo is shown age-progressed to 29 years. She was last seen at home on Ju…","Have you seen this child? ERIN POSPISIL

Erin's photo is shown age-progressed to 29 years. She was last seen at home on June 3, 2001 in Cedar Rapids, IA and she has not been seen or heard from since that day. #PictureThemHome 

https://t.co/YA15udyBHo",Sat Aug 18 20:53:42 +0000 2018
PeggyYates2014,"RT @aliasvaughn: 10. In all this, let's not forget McGahn has the same lawyer as Priebus, so if one cooperates... the other must say the sa…","10. In all this, let's not forget McGahn has the same lawyer as Priebus, so if one cooperates... the other must say the same things. Meaning: Mueller must have heard VERY interesting stories from Priebus as well. Bannon goes back and forth, so I'll leave him out.",Sat Aug 18 20:53:38 +0000 2018
ChristianMum22,"RT @LysaTerKeurst: ""So we must listen very carefully to the truth we have heard, or we may drift away from it."" (Hebrews 2:1, NLT)
 
May Go…","""So we must listen very carefully to the truth we have heard, or we may drift away from it."" (Hebrews 2:1, NLT)
 
May God's truth settle into every part of our hearts and transform us from the inside out.",Sat Aug 18 20:53:37 +0000 2018
hurtbybetrayal,"RT @LysaTerKeurst: ""So we must listen very carefully to the truth we have heard, or we may drift away from it."" (Hebrews 2:1, NLT)
 
May Go…","""So we must listen very carefully to the truth we have heard, or we may drift away from it."" (Hebrews 2:1, NLT)
 
May God's truth settle into every part of our hearts and transform us from the inside out.",Sat Aug 18 20:53:32 +0000 2018
CynthiaPinedaa,"i honesto dont know why, but when I was little my mom heard a rumor that @ItsJoshPeck had lipo and died from it, I was super sad think i went into depression fr",,Sat Aug 18 20:53:30 +0000 2018
fireman653706,"RT @LeaveEUOfficial: WATCH | @Michael_Heaver crushes Remaoner scaremongering about No Deal. ""You have to be able to walk away to get a good…","WATCH | @Michael_Heaver crushes Remaoner scaremongering about No Deal. ""You have to be able to walk away to get a good deal... we heard all this rubbish from Remain before the referendum. 500k job losses, recession - what happened to that?""

Support us at https://t.co/ntwXbJeHQw https://t.co/9iHAW82OWR",Sat Aug 18 20:53:28 +0000 2018
SaikoOfQuinx,"@HalfGhoulSeidou Saiko was walking alone in a dark alley. She had lost her way when she was assigned to investigate a report from an old lady regarding the sounds of a ghoul near the area. She had searched the area all day to find nothing. While she was walking, she heard someone call out her +",,Sat Aug 18 20:53:25 +0000 2018
Tonyconnor777,@londonblackcab3 @blackcabBot1 @TfLTPH Crawley is West Sussex. I have heard from friends  that they are  working in Crawley and showing local on Uber  app around there. I see them a lot all around there now as well,,Sat Aug 18 20:53:24 +0000 2018
hanybubble,@cherylurillo @boyband_nielm @delavinkisses 1st song she heard from the 2nd album. pano? e ang Hanggang Kailan Kaya ang paulit ulit sa radyo?,,Sat Aug 18 20:53:23 +0000 2018
RedSaintPotion,"RT @MissingKids: Have you seen this child? ERIN POSPISIL

Erin's photo is shown age-progressed to 29 years. She was last seen at home on Ju…","Have you seen this child? ERIN POSPISIL

Erin's photo is shown age-progressed to 29 years. She was last seen at home on June 3, 2001 in Cedar Rapids, IA and she has not been seen or heard from since that day. #PictureThemHome 

https://t.co/YA15udyBHo",Sat Aug 18 20:53:23 +0000 2018
D_Ericson,"RT @Beto4SenateSA: Beto is over halfway through his 34 day Texas road trip with a stop Friday in San Antonio @therockbox. 

Great chance to…","Beto is over halfway through his 34 day Texas road trip with a stop Friday in San Antonio @therockbox. 

Great chance to see the excellent @brittdaniel &amp; @cristela9. 
Even better chance to listen &amp; be heard by the next senator from the state of Texas @BetoORourke!

#betofortexas https://t.co/ZU2jEMTRqS",Sat Aug 18 20:53:15 +0000 2018
Pikayu9,"RT @TheOutli3R: Heard my husband scream ""NOOOOOO!"" from across the house, ran to see if he was okay, then discovered him watching that vide…","Heard my husband scream ""NOOOOOO!"" from across the house, ran to see if he was okay, then discovered him watching that video of the raccoon who tries to ""wash"" his cotton candy and then appear visibly upset when it dissolves in the water.",Sat Aug 18 20:53:13 +0000 2018
KiissMeKidrauhl,What was the last song you heard from @ArianaGrande ?,,Sat Aug 18 20:53:12 +0000 2018
TLLandrumPHD,"RT @KTAR923: Benjamin Ortega was last seen around his adult group home near 2000 East Brown Rd. at 10:30 a.m, police said. He has not been…","Benjamin Ortega was last seen around his adult group home near 2000 East Brown Rd. at 10:30 a.m, police said. He has not been seen or heard from since. https://t.co/0M0tmdhure",Sat Aug 18 20:53:11 +0000 2018
DarwinMcD,"RT @chriswatts1965: NEXT WEEK, 22 Aug: Another #InTheMoog Special with Gary Watts of @natureofwires in the studio with me!   Will be playin…","NEXT WEEK, 22 Aug: Another #InTheMoog Special with Gary Watts of @natureofwires in the studio with me!   Will be playing some tracks from NoW's next album and a never-heard-before remix for a 'tea-loving synth-pop duo from Bristol' - all #worldexclusives
@NCCRradio https://t.co/yuN8vicHU6",Sat Aug 18 20:53:09 +0000 2018
lilyfrance72,RT @CPBirmACcat: I heard the person who found me in my sorrowful state &amp; brought me to the centre called to see how I am. They couldn’t bel…,I heard the person who found me in my sorrowful state &amp; brought me to the centre called to see how I am. They couldn’t believe I’m doing so well &amp; have my own Twitter page! 😺I want to say a BIG thank you from the bottom of my paws! That kindness helped save me.❤️#luckyblackcat https://t.co/54YEgtyPTb,Sat Aug 18 20:53:07 +0000 2018
LolaWillFollow,RT @conservmia: XCIA Director Brennan stated that he has heard from lawyers who say “there is a very strong case” 2take legal action 2preve…,XCIA Director Brennan stated that he has heard from lawyers who say “there is a very strong case” 2take legal action 2prevent d president from revoking more clearances like he did Brennan. Sounds like ⁦⁦@JohnBrennan⁩ looking 4a gofundme! #Traitor  https://t.co/8wWBBLJJsg,Sat Aug 18 20:53:06 +0000 2018
SedonaBorn,RT @conservmia: XCIA Director Brennan stated that he has heard from lawyers who say “there is a very strong case” 2take legal action 2preve…,XCIA Director Brennan stated that he has heard from lawyers who say “there is a very strong case” 2take legal action 2prevent d president from revoking more clearances like he did Brennan. Sounds like ⁦⁦@JohnBrennan⁩ looking 4a gofundme! #Traitor  https://t.co/8wWBBLJJsg,Sat Aug 18 20:53:04 +0000 2018
notearsagb,y’all talkin shit about pharrell without even knowing the impact he had on radio stations back in the day just because you heard one song from despicable me😭,,Sat Aug 18 20:53:03 +0000 2018
GuyForgetOPT,"@drewphish @bizarchive I heard credible rumors from my JD sources that the late night set was going to be, in honor of @Jhartswick's birthday, 25 consecutive versions of Jennifer Dances.",,Sat Aug 18 20:53:02 +0000 2018
abbati_umar,"@Yadomah Last week, I heard of people in Buluma, mashi LGA Katsina unwilling to vote unless they got paid, reason: that's the only thing they get from politics! They are off grid,no single element of govt, except the polling unit. 
How can you tell them no? https://t.co/5t6pVp0pdY",,Sat Aug 18 20:53:02 +0000 2018
whatsherface91,When you think you’ve finally found a non retail job but it’s been a week and you haven’t heard back from the hiring manager 🙃,,Sat Aug 18 20:52:59 +0000 2018
LadyBelinda57,"RT @harrywall64: ⁦@The_LCDC⁩ ⁦@UnitedCabbies⁩ @TheLTDA
All three of you should be demanding that Uber’s license is withdrawn immediately.
I…","⁦@The_LCDC⁩ ⁦@UnitedCabbies⁩ @TheLTDA
All three of you should be demanding that Uber’s license is withdrawn immediately.
If she’s removed herself from the Brighton hearing she shouldn’t have heard Uber London’s appeal. https://t.co/BJJjN9aJWI",Sat Aug 18 20:52:55 +0000 2018
JoshWorksIT,@John_KissMyBot @cckisses4vc Do they though?  I heard it was already paid for and @potus has the power to appropriate funds from the black budget?,,Sat Aug 18 20:52:54 +0000 2018
buque09,RT @JosephScales: I’ve heard countless stories of workplace bullying in political offices of all persuasions. If anything comes from this H…,"I’ve heard countless stories of workplace bullying in political offices of all persuasions. If anything comes from this Husar story, can we please try and change that culture? #insiders",Sat Aug 18 20:52:53 +0000 2018
RealReneDupree,@Boogie_Monster8 Haven’t heard anything from them.,,Sat Aug 18 20:52:46 +0000 2018
Noori19996269,RT @V_sugarbaby: met a bunch of guys from Harvard yesterday and I kept pretending like I never heard of that school just to piss them off..…,"met a bunch of guys from Harvard yesterday and I kept pretending like I never heard of that school just to piss them off...one of them legit turned red when I said, “Harvard? Is that like a local community college?” LMAOOOOOO",Sat Aug 18 20:52:45 +0000 2018
blasianko,Haven’t heard from daddy since this morning they must making him pack it on up,,Sat Aug 18 20:52:43 +0000 2018
xerces0,"RT @TheOutli3R: Heard my husband scream ""NOOOOOO!"" from across the house, ran to see if he was okay, then discovered him watching that vide…","Heard my husband scream ""NOOOOOO!"" from across the house, ran to see if he was okay, then discovered him watching that video of the raccoon who tries to ""wash"" his cotton candy and then appear visibly upset when it dissolves in the water.",Sat Aug 18 20:52:38 +0000 2018
LindaWi39674276,"RT @RealJamesWoods: Haven’t heard from #JimAcosa about  being banned from a campaign event.   Why only #Nazis would do such a thing! And, o…","Haven’t heard from #JimAcosa about  being banned from a campaign event.   Why only #Nazis would do such a thing! And, of course, this #dingbat 👇🏻 https://t.co/8Uay6Ryyml",Sat Aug 18 20:52:37 +0000 2018
sameflannel,@rwxoxo @YouTube Crown Royyal evaporated after this and was never heard from again,,Sat Aug 18 20:52:33 +0000 2018
emmerish,menstruation// my pms is wicked mild comparitively from what i have heard but the number it does on my emotions is just Something Else,,Sat Aug 18 20:52:28 +0000 2018
EasyPeezyTweet,RT @EasyPeezyTweet: @koenamitra Heard #BharatTereTukde gang and Commies @cpimspeak #CPI are donating all funds they collected from #Pakista…,@koenamitra Heard #BharatTereTukde gang and Commies @cpimspeak #CPI are donating all funds they collected from #Pakistan and other #AntiIndian elements towards the #KeralaFloods #KeralaFloodRelief ? True @Shehla_Rashid @RanaAyyub @asadowaisi @UmarKhalidJNU @SitaramYechury @kavita_krishnan?,Sat Aug 18 20:52:26 +0000 2018
AasiyaKiyani,RT @ShahNafisa: Today our party chairman @BBhuttoZardari outclassed the #PrimeMinisterelect @ImranKhanPTI and @m_shahbazsharif. He was comp…,"Today our party chairman @BBhuttoZardari outclassed the #PrimeMinisterelect @ImranKhanPTI and @m_shahbazsharif. He was composed, dignified, the only leader who was heard by the entire house. He spoke from the heart &amp;he spoke to the real issues of Pakistan.",Sat Aug 18 20:52:21 +0000 2018
rebornjumpman,@nickiswrestling @mauroranallo @Christian4Peeps @EandCPod Yeah man. I had taken a 12 year break from wrestling and came back around Backlash last year. When I started catching up I heard some of the matches called by Mauro and absolutely loved them!,,Sat Aug 18 20:52:16 +0000 2018
royalistajoe,RT @conservmia: XCIA Director Brennan stated that he has heard from lawyers who say “there is a very strong case” 2take legal action 2preve…,XCIA Director Brennan stated that he has heard from lawyers who say “there is a very strong case” 2take legal action 2prevent d president from revoking more clearances like he did Brennan. Sounds like ⁦⁦@JohnBrennan⁩ looking 4a gofundme! #Traitor  https://t.co/8wWBBLJJsg,Sat Aug 18 20:52:15 +0000 2018
sewwutnow,RT @conservmia: XCIA Director Brennan stated that he has heard from lawyers who say “there is a very strong case” 2take legal action 2preve…,XCIA Director Brennan stated that he has heard from lawyers who say “there is a very strong case” 2take legal action 2prevent d president from revoking more clearances like he did Brennan. Sounds like ⁦⁦@JohnBrennan⁩ looking 4a gofundme! #Traitor  https://t.co/8wWBBLJJsg,Sat Aug 18 20:52:11 +0000 2018
Jsrunnlus,"RT @MissingKids: Have you seen this child? ERIN POSPISIL

Erin's photo is shown age-progressed to 29 years. She was last seen at home on Ju…","Have you seen this child? ERIN POSPISIL

Erin's photo is shown age-progressed to 29 years. She was last seen at home on June 3, 2001 in Cedar Rapids, IA and she has not been seen or heard from since that day. #PictureThemHome 

https://t.co/YA15udyBHo",Sat Aug 18 20:52:03 +0000 2018
katelinmjones,"RT @LysaTerKeurst: ""So we must listen very carefully to the truth we have heard, or we may drift away from it."" (Hebrews 2:1, NLT)
 
May Go…","""So we must listen very carefully to the truth we have heard, or we may drift away from it."" (Hebrews 2:1, NLT)
 
May God's truth settle into every part of our hearts and transform us from the inside out.",Sat Aug 18 20:52:03 +0000 2018
mafreiIa,has anyone heard from her ;;;,,Sat Aug 18 20:51:59 +0000 2018
_GaiaB,"RT @AbdullahAlhasem: Apparently, Pharrell has been in the music industry since the 90s but oddly, I haven’t heard anything from him until h…","Apparently, Pharrell has been in the music industry since the 90s but oddly, I haven’t heard anything from him until his chaotic-mess robotic song?",Sat Aug 18 20:51:52 +0000 2018
koto_enbot,"I really love making cute clothes, so when I heard about school idols from Honoka-chan, I went, ""All right! ☆""",,Sat Aug 18 20:51:51 +0000 2018
EasyPeezyTweet,@koenamitra Heard #BharatTereTukde gang and Commies @cpimspeak #CPI are donating all funds they collected from #Pakistan and other #AntiIndian elements towards the #KeralaFloods #KeralaFloodRelief ? True @Shehla_Rashid @RanaAyyub @asadowaisi @UmarKhalidJNU @SitaramYechury @kavita_krishnan?,,Sat Aug 18 20:51:48 +0000 2018
amiilime,Naomi &amp; I have been in line &amp; have already heard the first act of Hamilton from the girl in front of us.,,Sat Aug 18 20:51:47 +0000 2018
yogagenie,RT @conservmia: XCIA Director Brennan stated that he has heard from lawyers who say “there is a very strong case” 2take legal action 2preve…,XCIA Director Brennan stated that he has heard from lawyers who say “there is a very strong case” 2take legal action 2prevent d president from revoking more clearances like he did Brennan. Sounds like ⁦⁦@JohnBrennan⁩ looking 4a gofundme! #Traitor  https://t.co/8wWBBLJJsg,Sat Aug 18 20:51:46 +0000 2018
BudGreen9,“ I’m madder than hell and I’m not going to take it”. I just want to see the photo that shows him exploding into a billion pieces. Never to be heard from again! https://t.co/nk1v88HK1U,,Sat Aug 18 20:51:38 +0000 2018
JBthaBOSS,lmao Keithen bought madden about 10.. haven’t heard from the nigga since 12,,Sat Aug 18 20:51:36 +0000 2018
danandshayes,"Would you rather have Donald Trump or Kanye West as your president? — From what I know/heard/read about them, none of them. https://t.co/vz1BO2FtBV",,Sat Aug 18 20:51:34 +0000 2018
DanHemi,"NEVER buy a car at Pine Belt Nissan in Keyport. Absolute worst costumer service I ever had to deal with. I heard three different stories from unhelpful employees. Seriously, DO NOT give them your business!",,Sat Aug 18 20:51:28 +0000 2018
Sinisteran,@LifeofRio it's too late especially after all the crappy advice i heard from you,,Sat Aug 18 20:51:24 +0000 2018
Krahvulon,"@GoblinGalOzzy ""It feels like-"" He paused for a moment as he heard her last sentence, blinking several times before he gave a simple nod. ""Do rahlo, bek, just. . .dodon't forget your luggage."" And with that, he pinched the stem with his index finger to stop it from exploding. ""I was going to-",,Sat Aug 18 20:51:23 +0000 2018
stefjyl16,"RT @TheOutli3R: Heard my husband scream ""NOOOOOO!"" from across the house, ran to see if he was okay, then discovered him watching that vide…","Heard my husband scream ""NOOOOOO!"" from across the house, ran to see if he was okay, then discovered him watching that video of the raccoon who tries to ""wash"" his cotton candy and then appear visibly upset when it dissolves in the water.",Sat Aug 18 20:51:22 +0000 2018
03_jensen,"RT @BethDarnall: If you have chronic pain, you may have heard people say ""it's all in your head.""
Nothing could be further from the truth.…","If you have chronic pain, you may have heard people say ""it's all in your head.""
Nothing could be further from the truth. Your #pain is REAL.

Help spread this message by retweeting!

#YourPainIsReal",Sat Aug 18 20:51:21 +0000 2018
DanchoEva,"RT @MissingKids: Have you seen this child? ERIN POSPISIL

Erin's photo is shown age-progressed to 29 years. She was last seen at home on Ju…","Have you seen this child? ERIN POSPISIL

Erin's photo is shown age-progressed to 29 years. She was last seen at home on June 3, 2001 in Cedar Rapids, IA and she has not been seen or heard from since that day. #PictureThemHome 

https://t.co/YA15udyBHo",Sat Aug 18 20:51:18 +0000 2018
MGahannon,"RT @RealJamesWoods: Haven’t heard from #JimAcosa about  being banned from a campaign event.   Why only #Nazis would do such a thing! And, o…","Haven’t heard from #JimAcosa about  being banned from a campaign event.   Why only #Nazis would do such a thing! And, of course, this #dingbat 👇🏻 https://t.co/8Uay6Ryyml",Sat Aug 18 20:51:12 +0000 2018
aburomessi,"RT @GbengaWemimo: He got married a year later
She heard about it from a friend
She didn't believe he married someone else
Didn't he say he…","He got married a year later
She heard about it from a friend
She didn't believe he married someone else
Didn't he say he loves her?
Isn't love supposed to cover a multitude of sins and errors?
Why didn't he come looking for her?
7 years later, she is still asking questions",Sat Aug 18 20:51:11 +0000 2018
ashscvrls,"RT @typosfor5sos: A quick reminder:

If you hate Want You Back, you really need to square the fucking fuck up

I've heard that song at leas…","A quick reminder:

If you hate Want You Back, you really need to square the fucking fuck up

I've heard that song at least a million times, and I'm still so obsessed with it and y'all can't stop me from bopping cause I know you do too

(plz dont take this too seriously ily all) https://t.co/N50dnYNAMI",Sat Aug 18 20:51:04 +0000 2018
_NatureTalks_,"@ModifiedAbyss She could feel her cheeks heat up. Ah, she was glad she managed to get a smile out of him. He has always seemed like such a wonderful person from what she had heard and seen of him. She knew her words wouldn't hold much in the long run but if they helped today that was all --",,Sat Aug 18 20:51:03 +0000 2018
Lumuumba,@rianjohnson heard Disney fired you lol no more bad star wars movie from you lol,,Sat Aug 18 20:51:03 +0000 2018
ohribia,"RT @TheOutli3R: Heard my husband scream ""NOOOOOO!"" from across the house, ran to see if he was okay, then discovered him watching that vide…","Heard my husband scream ""NOOOOOO!"" from across the house, ran to see if he was okay, then discovered him watching that video of the raccoon who tries to ""wash"" his cotton candy and then appear visibly upset when it dissolves in the water.",Sat Aug 18 20:51:03 +0000 2018
annabba_,"RT @TheOutli3R: Heard my husband scream ""NOOOOOO!"" from across the house, ran to see if he was okay, then discovered him watching that vide…","Heard my husband scream ""NOOOOOO!"" from across the house, ran to see if he was okay, then discovered him watching that video of the raccoon who tries to ""wash"" his cotton candy and then appear visibly upset when it dissolves in the water.",Sat Aug 18 20:50:54 +0000 2018
CupcakeThighs,"RT @KivaBay: Lmao I just... show of hands, how many times have fat people heard from people who have hurt them that it comes from a place o…","Lmao I just... show of hands, how many times have fat people heard from people who have hurt them that it comes from a place of compassion https://t.co/vQMgNPrhCx",Sat Aug 18 20:50:52 +0000 2018
StuartWiddowson,"@gazhill18 @ChesterfieldFC From what I’ve heard we were garbage again Bro, up to now there’s only been Aldershot where we looked decent, other wins we have been very lucky.",,Sat Aug 18 20:50:52 +0000 2018
rpsabo,"@MaisieTillyWFT 
Y’all okay? Ain’t heard from y’all. Stay in touch! 👋🏻👋🏻❤️❤️🇺🇸🇺🇸",,Sat Aug 18 20:50:48 +0000 2018
MartinB45719553,RT @conservmia: XCIA Director Brennan stated that he has heard from lawyers who say “there is a very strong case” 2take legal action 2preve…,XCIA Director Brennan stated that he has heard from lawyers who say “there is a very strong case” 2take legal action 2prevent d president from revoking more clearances like he did Brennan. Sounds like ⁦⁦@JohnBrennan⁩ looking 4a gofundme! #Traitor  https://t.co/8wWBBLJJsg,Sat Aug 18 20:50:47 +0000 2018
SSunshineBooks,"RT @LysaTerKeurst: ""So we must listen very carefully to the truth we have heard, or we may drift away from it."" (Hebrews 2:1, NLT)
 
May Go…","""So we must listen very carefully to the truth we have heard, or we may drift away from it."" (Hebrews 2:1, NLT)
 
May God's truth settle into every part of our hearts and transform us from the inside out.",Sat Aug 18 20:50:45 +0000 2018
