StaunchAdmiral,"@CaptainWillT The same sword from all those years ago, meet the coolness of his palm his gaze softening ever so slightly. This sword hadn't only killed William, but it had also caused severe damage to himself. He remembered that day like it was yesterday. The cost -",,[3]
ICgetsIT,"Don't let these persistent cloud cost myths damage your strategy, lead to cost overruns, or feed ""told you so"" political arguments. https://t.co/I6Kk2cZxQt by @4enterprisers #Cloud #DigitalTransformation #CostOptimization #CostEfficiency #ICgetsIT #IT #Louisiana #LouisianaBiz",,[3]
therealgregjack,@carol_stirling @egorub @BetterAuckand @mrbarnabyb @bernardchickey It appears to be a lethal combo of tight margins and cost inflation doing the damage.,,[3]
SealedAirPack,RT @Sealed_Air: #Ecommerce companies underestimate the cost of damaged returns to their business and the environment. https://t.co/pHa5qapP…,#Ecommerce companies underestimate the cost of damaged returns to their business and the environment. https://t.co/pHa5qapPLn #sustainability #damage https://t.co/2uS3eJXDNY,[3]
MGrefe99,RT @HarpSealsDotOrg: The Federal Government wants to waste more tax $$ on distractions #BillS3119 - Dams have cost the taxpayers billions t…,The Federal Government wants to waste more tax $$ on distractions #BillS3119 - Dams have cost the taxpayers billions to mitigate the damage done to salmon. Slaughtering sea lions/cormorants - been there done that - didn't work. #StopTheCull #FreeTheSnake https://t.co/Zz9PNqLdXi,[3]
SteveBowenWx,"YTD 2018 Natural Disaster stats in #Vietnam

- 112 dead/missing
- 48,070 homes damaged/destroyed
- 482,900 crop acres damaged
- $257M economic cost

...FY 2017 incurred $2.6B in economic damage, which was well above normal.",,[3]
johnbuckeyenut,"@11W Rumors and accusations seem to be enough to cost a person their job,family, and reputation theses days. Even if a person is found not to be a fault, the damage is done. The media will seize on any small bit of a ""story"" and if they can make a BIG name connection then it is",,[3]
barbfriedberg,You must read my 'tell all' investing story @GoBankingRates about how fear hurt my net worth &amp; cost me thousands of dollars. Fear Punished My Net Worth — Don't Let It Damage Yours https://t.co/krAwD1xVV3 #investing #PersonalFinance #Secrets #SmartMoneySquad Please RT https://t.co/8yPyArY5E7,,[3]
MrScottMaths,"@D_M_Calvin @PaulGarvey4 In the long term, cuts cost more money as you have to repair the damage caused.",,[3]
BrookingsInst,Some of the migrant children who have been reunited with their parents are already exhibiting signs of trauma. Why that could have a lasting impact: https://t.co/lQUEDfWXBO https://t.co/2xOh6fxSgl,,[3]
realMcFlappy,"Lets use this as a tool to discourage tobacco, which should be re-evaluated as an entire enterprise.  This COST US SO MUCH MONEY.  And the taxes of the addiction to nicotine does damage to our economy.  I can't even figure what it costs.",,[3]
insurtechtalk,"How  Tractable is applying artificial intelligence to accident and disaster recovery. 

Accident and disaster recovery starts with cost and labour intensive visual damage appraisal: look at the damage, say how much it’s going to cost, unlock the funds and…https://t.co/kGdf8rDvZx",,[3]
oofi6864,"RT @Hankinstien: Wow. CIA's own contemporary estimates: In 1965, it cost the US $6.60 to do $1 worth of damage to communist forces in Vietn…","Wow. CIA's own contemporary estimates: In 1965, it cost the US $6.60 to do $1 worth of damage to communist forces in Vietnam. In '66, went up to $9.60. Rolling Thunder did $600 mill. of damage, but just the cost of replacing lost aircraft alone was $6 billion",[3]
JohnHulett1,Why do protester leave their crap for other to clean up. They should have to pay a damage deposit to cover the cost. https://t.co/f5cznM8s8m,,[3]
xo_Damage,"RT @416Bando: I just finished applying to PhD programs. I applied to five schools.

It cost me $713.

We need to have a serious conversatio…","I just finished applying to PhD programs. I applied to five schools.

It cost me $713.

We need to have a serious conversation, as a community, about how exclusionary this is to people without much disposable income.",[3]
ORCAfest2016,RT @Casey_Pup: The Federal Government wants to waste more tax $$ on distractions #BillS3119 - Dams have cost the taxpayers billions to miti…,The Federal Government wants to waste more tax $$ on distractions #BillS3119 - Dams have cost the taxpayers billions to mitigate the damage done to salmon. Slaughtering sea lions/cormorants - been there done that - didn't work. #StopTheCull #FreeTheSnake https://t.co/uRuBD5xwWB,[3]
KayRoss4,"Albo is making sure that while LNP is in damage control. That their agenda has not changed! They want to remove all funding to all public.  Cost to them and subsequently through high fee cost to you, the public https://t.co/vyNIjPy9Ig",,[3]
mel567,@RepMattGaetz Economies only grow so long before recession hits. This economy has been on the upswing for nearly a decade. Trumps tariffs and exploding defies will likely slow things. While deregulation puts tax payers at risk for cost of environmental damage by corporations.,,[3]
brown_dody,"@Tyler_Lancaster @JetsetTX @DianeRetter @RoryWainer @realDonaldTrump The co. Buy backs instead of raising wages? Tariffs against our allies? We had a trade surplus, as calculated, with Canada. Tariffs can do damage, some irreparable to our economy &amp; businesses, the farmers, already feel it. We, also, like to be able to buy low cost goods.",,[3]
MarocMarj,@johnmcdonnellMP &amp; cost of food to go up with heat crop damage &amp;this darn Brexit melarky  Just been thinking in 1970 my housekeeping was £8 a week... now £100 is like fiver it does not go far at all. so no chance for those BY LAW on £73.10 a WEEK+ having to pay council!,,[3]
FCNLJustice,"Nationwide average cost for juvenile incarceration is a staggering $88,000 per year. Effective JJ diversion programs can save tax payers between $13,000-$37,000 a year. But there's no way to monetize the damage of youth incarceration.
#JJDPAmatters #CJReform",,[3]
Nelsonrow80,RT @JubileeSilver: How desperate are these people that they rip a hole in our roof to try and gain access. More damage more cost. We don’t…,How desperate are these people that they rip a hole in our roof to try and gain access. More damage more cost. We don’t leave money or valuables at SJP we are a community club @HendonFC @EdgwareTownFC @HendonFCSA @EtfcFans @Rob_Bernard @Shottersshouts @Dannat23 @HFC_Guv @JCreith https://t.co/KkLcNZ1aru,[3]
dr_lungs,"@stu1smartcookie @Smeloniew1970 @ReevesJek @EmmaKennedy @AntonioBonanza @DancingTheMind It is facts. We don't need to wait till Brexit happens to see this effect. The numbers of nurses coming here from other parts of EU has already fallen dramatically from the time of the referendum.
If Brexit has any benefits it will be at the cost of significant damage to NHS.",,[3]
Matt_Dozza,"@alana_brownxo Much damage? I had one where I pulled out and next second my door was caved in. Cost me a bit but car was fine. Hopefully not to much damage, And the main thing you are all good 👌🏻",,[3]
rbc12steps,"@JoePerticone Archive your tweet somewhere. Because the price McConnell paid for those SCOTUS seats, while abetting a racialist President and GOP, may cost the party its future. Between demographic change and the damage Trump wrecks on a daily basis, I'm not betting on McConnell's gambit.",,[3]
tonightxalivx,(i.e. the £500k cost to local council in dudley over damage to local property) they have sent death threats to journalists who cover their marches. supporters have made nazi salutes. EDL activist simon beech was jailed for an arson attack on a mosque.,,[3]
tonightxalivx,many people in the movement have been part of wider facists organisations. edl marches have a high financial cost due to the amount of police officers (policing the Leicster demonstration in 2010 cost £850k) and damage to community.,,[3]
Sealed_Air,#Ecommerce companies underestimate the cost of damaged returns to their business and the environment. https://t.co/pHa5qapPLn #sustainability #damage https://t.co/2uS3eJXDNY,,[3]
hasssaaannn,"RT @iMicknl: And today, after 8 days, they called that the reparation will cost +700 € instead of 0, due to user damage. And that they acci…","And today, after 8 days, they called that the reparation will cost +700 € instead of 0, due to user damage. And that they accidentally made a even bigger crack in my screen by cleaning it… 🙄 https://t.co/Kzg5Ti5sHa",[3]
LincolnFresno,"“Inhumane” says the person who celebrated the death of a First Lady because of political differences.

She’s cost @Fresno_Statemillions, plus reputational damage, plus the valuable time of @JosephICastrocleaning it up. Sick.

https://t.co/LpRnUtd32g",,[3]
jenL_ostrowski,Very diasappointed with @cube_bikes - only willing to cover me for ‘crash damage’ (which would have cost me and meant a non-matching frame) to a virtually new bike which hadn’t been in a crash and was clearly a faulty carbon frame which could have resulted in a really bad injury. https://t.co/CStCK3viVw,,[3]
risk_research,RT @Deon_Nel_: Missing the Paris 1.5°C Climate Target will cost 14 Trillion dollars in flood damage or 3% of global GDP per annum https://t…,Missing the Paris 1.5°C Climate Target will cost 14 Trillion dollars in flood damage or 3% of global GDP per annum https://t.co/gvIkylquev,[3]
WealthHatch,"Yes it can be risky! A huge exchange rate shift can damage your financial position....BUT don't  pull your investments out just yet, markets are constantly moving and a hasty decision can cost you more in the long run.

Be Prudent and do your analysis an… https://t.co/bHNeTX10Oi https://t.co/8g8TFURLPA",,[3]
CriticalRiposte,"@sibuegoesbyebye @DebbieAAldrich @jack @TrumpsBelle @RealJamesWoods @RealKyleMorris @benshapiro @RubinReport @DennisPrager @DineshDSouza Some people are scrambling to do as much damage as they possibly can. It's going to cost us man-hours and capital, if it doesn't cost us lives and future opportunities.",,[3]
CDW_Healthcare,"The cost of breaches in #healthcare is high — not just due to network damage or data theft, but rather to the loss of reputation that leads to a lack of info, strained relationships w/ other biz, edu and a loss of customers. Learn more via @HealthITnews: https://t.co/eoEj8puYFB",,[3]
allijmo,"@NorthamptonBC This is disappointing to say the least. When I first asked for this to be dealt with in February I advised that it was preventing me having roof repairs done on my property. The damage is worse now due to the delay,  will the council contribute to the cost of repairs?",,[3]
Pheqes,"Someone just tried to troll me because I picked Fiddle mid.

5 damage reduction and 20 mana cost on one ability just doesn't make him viable to the point of rage from other players I guess.",,[3]
TheFallenStars,"Did you all know that @Hertz has an incentive program for their employees to find more damage on rental car returns? Bonuses if they claim more damage. 

Was told this by a Hertz employee as then he explained why the scratches on the side of the carl were going to cost me €2200.",,[3]
HarpSealsDotOrg,The Federal Government wants to waste more tax $$ on distractions #BillS3119 - Dams have cost the taxpayers billions to mitigate the damage done to salmon. Slaughtering sea lions/cormorants - been there done that - didn't work. #StopTheCull #FreeTheSnake https://t.co/Zz9PNqLdXi,,[3]
marty6077,"RT @ICORrefrigerant: Replacing a well-known #refrigerant with a cheaper, low-quality one can cost you equipment damage, reputation and cust…","Replacing a well-known #refrigerant with a cheaper, low-quality one can cost you equipment damage, reputation and customers. 

Download the Bulletin here for more information: https://t.co/jDh1c335HS https://t.co/OOcoYQLnoP",[3]
RoseChimera1,RT @TilikumCo: The Federal Government wants to waste more tax $$ on distractions #BillS3119 - Dams have cost the taxpayers billions to miti…,The Federal Government wants to waste more tax $$ on distractions #BillS3119 - Dams have cost the taxpayers billions to mitigate the damage done to salmon. Slaughtering sea lions/cormorants - been there done that - didn't work. #StopTheCull #FreeTheSnake https://t.co/njfPtCeYWJ,[3]
iMicknl,"And today, after 8 days, they called that the reparation will cost +700 € instead of 0, due to user damage. And that they accidentally made a even bigger crack in my screen by cleaning it… 🙄 https://t.co/Kzg5Ti5sHa",,[3]
AdvancedLeak,"The average cost of repairing water damage from faulty plumbing in the US is 17,500 - if you see signs of a leak such as moldy drywall, wet walls or carpeting, and peeling or discolored paint, don't waste any time - call us today at 503-650-5325 or visit https://t.co/V92claAaIX https://t.co/U2zOZWjiNZ",,[3]
TilikumCo,The Federal Government wants to waste more tax $$ on distractions #BillS3119 - Dams have cost the taxpayers billions to mitigate the damage done to salmon. Slaughtering sea lions/cormorants - been there done that - didn't work. #StopTheCull #FreeTheSnake https://t.co/njfPtCeYWJ,,[3]
howgreenisthis,Ontario fire that workers allege began at a wind farm construction site could cost tens of millions of dollars https://t.co/kkfzYY8DGD,,[3]
DrZeitghost,"@grahambsi @RebetikoWalrus Damage limitation I expect.

How much would a hard Brexit cost?

It's ok though. As Rees Mogg himself has told us we COULD potentially maybe see benefit in 50 years possibly.

But he could be wrong.

I like those odds.",,[3]
MultCoSustain,"Although ""most countries will be richer by the end of this century, and societies are adaptable, both of which ought to reduce the harm from a warming climate,"" an exhaustive new study has a sobering conclusion when solely focusing on heat-related damage. https://t.co/YTRMnGLmEO",,[3]
Echoworx,Ever lost $3.5M? That's what a data breach can cost you. But preparing for the big one can help you minimize the damage. Learn how: https://t.co/10iHbX08rT #encryption #cybersecurity #databreach #dataprivacy #datasecurity https://t.co/EnGwn1Kpfe,,[3]
illingworthrsch,"Hi @lenovo I am trying to get through to your support to find out how much an accidental damage upgrade would cost on a laptop we purchased less than 3 months ago. I was on the phone for 70 minutes but no answer, live chat didn't know anything about it and I've been disconnected.",,[3]
FrankBassF9Ca5,RT @susanette31: @davidsting414 @FrankBassF9Ca5 @Protect_Wldlife @Ivy_Middleton @_AnimalAdvocate @joannakrupa @RobRobbEdwards Those who lov…,"@davidsting414 @FrankBassF9Ca5 @Protect_Wldlife @Ivy_Middleton @_AnimalAdvocate @joannakrupa @RobRobbEdwards Those who love protect at any cost without calculating the damage they could suffer &amp; baby elephant knows that his family needs to be protected from men! This is really #Love 
So cute! 😘🐘💞💞",[3]
CockiBeverloo,The Federal Government wants to waste more tax $$ on distractions #BillS3119 - Dams have cost the taxpayers billions to mitigate the damage done to salmon. Slaughtering sea lions/cormorants - been there done that - didn't work. #StopTheCull #FreeTheSnake https://t.co/az5Wn5U3oY,,[3]
Vannish_lol,"In the end, I don't think its really worth the loss of very early damage, I think its good for a champion like Lee Sin to be able to execute squishy targets more effectively, but not at the cost of early snowball potential. 

(5/5)",,[3]
TristianSpirit,The Federal Government wants to waste more tax $$ on distractions #BillS3119 - Dams have cost the taxpayers billions to mitigate the damage done to salmon. Slaughtering sea lions/cormorants - been there done that - didn't work. #StopTheCull #FreeTheSnake https://t.co/eTJSsuaUlt,,[3]
JessPerry_NJ,"RT @DanielMunoz100: .@NewJerseyOAG Grewal @NewJerseyDEP announce 6 environmental actions, includes 3 cost-recovery suits, 3 natural resourc…",".@NewJerseyOAG Grewal @NewJerseyDEP announce 6 environmental actions, includes 3 cost-recovery suits, 3 natural resource damage cases at #newark #ironbound press conference https://t.co/81pkMepQeF",[3]
TheRabenGroup,“The trauma that many of these parents and children are experiencing on American soil threatens to undermine their future development via the impact of toxic stress.” https://t.co/rzqOc59oXY,,[3]
DanielMunoz100,".@NewJerseyOAG Grewal @NewJerseyDEP announce 6 environmental actions, includes 3 cost-recovery suits, 3 natural resource damage cases at #newark #ironbound press conference https://t.co/81pkMepQeF",,[3]
MoreTeaDebra,RT @GaryDelaney: It’s estimated the cost of the damage could be in the hundreds and thousands. https://t.co/4x5ALUOI9u,It’s estimated the cost of the damage could be in the hundreds and thousands. https://t.co/4x5ALUOI9u,[3]
linny55,RT @justeconomics: This is a superb and accurate reflection of Ireland by Juno McEnroe. Varadkar's government hates the people and loves th…,This is a superb and accurate reflection of Ireland by Juno McEnroe. Varadkar's government hates the people and loves the corporate sector. People are just collateral damage and cost in FG neoliberal minds Tax-break Ireland is no country for the vulnerable https://t.co/JvkBpsFI3f,[3]
Jibsman1,"@RealEdmeji I hope she has a few things to cover the cost of the damage because we're trading everything available 😂. 

And... 

If she no get money she get place to borrow 🎶",,[3]
dk_peace,@realDonaldTrump No one thought that calling Canada a security risk and starting a trade war was a good idea. The damage to other sectors of our economy and to our international reputation are too high a cost.,,[3]
BrakeQuipLancs,"When your car is trying to tell you something, don’t ignore it. If you postpone repairs, you risk additional damage that can cost hundreds or even thousands of dollars to fix. https://t.co/FwnhQOxO17",,[3]
cathayschris,The crisis of underfunding crucial local public services is getting deeper. The damage being done will last years. It's short sighted as well as wrong - the human &amp; financial cost will be paid for a long time. https://t.co/NTc6I6FED5,,[3]
winnyooms,"RT @stefaniei: An exhaustive new study focusing only on heat-related damage reaches a sobering conclusion: by the year 2099, even with econ…","An exhaustive new study focusing only on heat-related damage reaches a sobering conclusion: by the year 2099, even with economic growth and adaptation, 1.5 million more people will die each year around the world because of increased heat. https://t.co/Ag6EyG0xGn via @WSJ",[3]
Amel_Benmann,"Hogs run wild and wreak havoc on farms but USDA redoubling efforts to fight problem: Wild hogs are in at least 39 states and cost up to $2.5 billion annually due to the damage they cause farmers and other industries, but the USDA is fighting back and may… https://t.co/jzP4z6CL6h https://t.co/BqLTRmvydk",,[3]
Dowellenough,@HannahQuirk1 @PenelopeGibbs2 ... or perhaps we should introduce the legal advice at the earliest possible moment. The initial outlay would be worth the benefits of avoiding the terrible societal damage that is cost of getting things wrong?  *noting that in this case that happened.,,[3]
exlo_alkoot,"@SophiaCannon @BashaR_aljazzaf any other phone get battery damage if it gets over charged except for the iphone because in iphones there‘s a technology that sends back the extra power to the cable so the cable gets damaged instead of the iphone battery, the cable cost 10$ while the battery cost 60$ thanx apple",,[3]
LinesDavid,"@AgricSimon @MaddeverAndrew Seems about right, plenty of beans but very small but virtually no bruchid damage on unsprayed crop.
Think s beans might just cover cost of harvesting",,[3]
AlimonteLina,"RT @shilohwalker: @GovHowardDean @herhandsmyhands Counseling can help and it should be offered and started immediately, at no cost to the p…","@GovHowardDean @herhandsmyhands Counseling can help and it should be offered and started immediately, at no cost to the parents. @realDonaldTrump @jeffsessions @SecNielsen should be held responsible for the damage they imparted on those kids &amp; should be the ones accountable for the help the families will need.",[3]
justeconomics,This is a superb and accurate reflection of Ireland by Juno McEnroe. Varadkar's government hates the people and loves the corporate sector. People are just collateral damage and cost in FG neoliberal minds Tax-break Ireland is no country for the vulnerable https://t.co/JvkBpsFI3f,,[3]
DAGauteng,"RT @DA_JHB: ""Under the ANC administration, the City did not replace infrastructure until it actually failed in an effort to save money. Thi…","""Under the ANC administration, the City did not replace infrastructure until it actually failed in an effort to save money. This meant knock-on damage to other infrastructure - which cost even more to replace."" - MMC @NicoDeJager64  #DAdelivers",[3]
brunty7,RT @ritustweets: Hi @Lendleaseuk NOW would be a really good time to show you truly understand Corporate Social Responsibility. The enormous…,Hi @Lendleaseuk NOW would be a really good time to show you truly understand Corporate Social Responsibility. The enormous damage you are doing to your reputation will cost a LOT more than £3-4mil to fix. #CladdingScandal #LeaseholdScandal https://t.co/JiiNPMBtyT,[3]
IficialArt,"@NeilMcMahon @plalor @laurenetrim Ok compassion is always good, but I’m sure you know - lawyers will seek a review of every arrest this guy has made. Criminal cops damage more than their own careers when their caught.  This can cost NSW a good deal of money and sullies the name of professional cops in nsw.",,[3]
PokemonItems,Babiri Berry: Half the amount of damage taken by super-effective moves. Can be found under 'Berries'. Cost: 20 Pokédollars.,,[3]
Fallenberg,"Hogs run wild and wreak havoc on farms but USDA redoubling efforts to fight problem: Wild hogs are in at least 39 states and cost up to $2.5 billion annually due to the damage they cause farmers and other industries, but the USDA is fighting back and may… https://t.co/NdaFgNJV9J https://t.co/XSVtALRkvV",,[3]
KHillsmith,"@Jacob_Rees_Mogg Try asking Walsh the financial cost has been to BA, Easyjet so far thanks to your Brexit ideology. Not to mention sending Monarch Airlines bust.  But people like you and your followers do not care about the damage you inflict to get what you want.",,[3]
HillbillyTruth,"@azcentral @MeghanMcCain We will be better without him!  That sorry POS has cost America numerous lives and a trillion dollars for his little Obamacare Tantrum!  A Damn Trillion dollars!  Think about 1 man causing so much damage, oh wait the aircraft carrier!   Either in denial, or Maxine level IQ",,[3]
Double__Click__,"Hogs run wild and wreak havoc on farms but USDA redoubling efforts to fight problem Wild hogs are in at least 39 states and cost up to $2.5 billion annually due to the damage they cause farmers and other industries, but the USDA is fighting back and may get more money from C…",,[3]
xpaintitblack7x,"Just narrowly avoided a disaster that could have caused lots of property damage and even could have cost the lives of my pets, my mom, sister, and/or myself. I don’t think I will be getting much sleep tonight 😰",,[3]
Chrismarcel,"RT @copyconstruct: ""the whole point of [actual] distributed systems engineering is you assume you're going to fail at some point in time an…","""the whole point of [actual] distributed systems engineering is you assume you're going to fail at some point in time and you design the system in such a way that the damage, at each point is minimized, that recovery is quick, and that the risk is acceptably balanced with cost"" https://t.co/ZHz7ZqlVLi",[3]
auldnate,"@WontMarch4Soros …Healthy ppl get hit by cars too. You might not have Cancer today, but the future is uncertain. I was 22, &amp; in excellent health when I found a #BrainTumor in my head that cost# $450K to remove &amp; repair the damage. I was just lucky, &amp; my Dad had a policy that covered my care…",,[3]
DA_JHB,"""Under the ANC administration, the City did not replace infrastructure until it actually failed in an effort to save money. This meant knock-on damage to other infrastructure - which cost even more to replace."" - MMC @NicoDeJager64  #DAdelivers",,[3]
_ChosetoLive,"@GhostARCTroop She winced, barely able to see the wreck of the ship behind her. The young Pantoran didn’t need to see the damage to know what was true: she had been the only survivor in an attack that had cost her two of her most trusted advisors.

Riyo tucked her head down, sighing.",,[3]
WagnerMomma,"@MarkDav65721158 @FirestormRdr @realDonaldTrump Yes, he has made some headway with NK but at what cost?  He is causing more damage to our nation and its resources than we can truly sustain.  If that is making America great, all I can do is weep for our once great nation that he is tearing apart piece by piece.",,[3]
NewsDingo,"Wild hogs are in at least 39 states and cost up to $2.5 billion annually due to the damage they cause farmers and other industries, but the USDA is fighting back and may get more money from Congress.
https://t.co/hXQPcM7Dz6",,[3]
twoscoopsplease,@realDonaldTrump Wow. She literally colluded with a Chinese spy for 20 years. I can’t imagine the secrets and damage that cost our country. Let’s all watch as the fake news media fails to cover this bombshell story.,,[3]
