BrookingsGlobal,Some of the migrant children who have been reunited with their parents are already exhibiting signs of trauma. Why that could have a lasting impact: https://t.co/8HbY3oNL3i https://t.co/HVQizLnMuN,,[3]
onedvsdj,"@SRuhle @IvankaTrump Who knew Immigration was hard right, incentivising (detention centers making millions) behavior that puts children coming from Death Threats and harm at risk,millions before Never seperated,held together at much less cost,Major Damage done to these families, #oneluv #savechildren",,[3]
delexical,"@fromTGA @mvanhulten @CER_Grant @CER_EU An embittered UK, an alienated UK, are things the EU can tolerate as long as the damage is confined primarily to the UK. But outside trade where the cost of Brexit is built into Brexit, what damage is going to occur in Narva, Duisberg, Taranto, Split, Montpellier, Wroclaw?",,[3]
RustyStainless,"RT @georgefwoods: Again, many submission supported making coal mining operations pay for the damage cost of their air pollution, as power s…","Again, many submission supported making coal mining operations pay for the damage cost of their air pollution, as power stations, cement factories and others do https://t.co/15MKfU7JqZ",[3]
georgefwoods,"Again, many submission supported making coal mining operations pay for the damage cost of their air pollution, as power stations, cement factories and others do https://t.co/15MKfU7JqZ",,[3]
Joebudd22,You open my door recklessly and it gets smacked off in traffic you will pay for that shit any damage to my car you cost you will pay for that shit,,[3]
suunKisst,RT @Maaani__: UVA &amp; UVB rays age your skin at about 85% the rest is genetics !!! 😩😩😩 It’s hard to REVERSE sun damage &amp; cost A LOT of money…,UVA &amp; UVB rays age your skin at about 85% the rest is genetics !!! 😩😩😩 It’s hard to REVERSE sun damage &amp; cost A LOT of money &amp; treatments !!!,[3]
CapitolEVAN,RT @WillMooreSD: Today's unanimous CA Supreme Court decision is a throughgoing repudiation of the stunning arrogance of some of our past an…,Today's unanimous CA Supreme Court decision is a throughgoing repudiation of the stunning arrogance of some of our past and present city leaders.  It will cost us all a fortune to repair the damage their lawless right-wing fervor has done and that stain will mar their legacies.,[3]
floodlebell,RT @DrewVirgin: @CampusCourtUK One of my best friends moved into an apartment that cost $839 a month and this is what you give him?! THERES…,@CampusCourtUK One of my best friends moved into an apartment that cost $839 a month and this is what you give him?! THERES WATER DAMAGE AND MOLD ALL OVER THE WALLS AND CEILING!! MORE PICTURES TO COME https://t.co/Qft4QYmiyj,[3]
NewImproved9,Canadian Taxpayers will be picking up the tab on the damage. So much for the short older French guy on CBC 3 years ago who said Canadians would have full disclosure on what it would cost to bring these 3rd world country people in to our country! https://t.co/ZM4U6cLm1X,,[3]
martinezserrap1,"Its the Summer! Holidays! Traveling everywhere. Time to see the World. Nowadays it is great, everybody goes to places. A reflection: are we aware of the environmental impact (damage) we are inflicting to our planet? . Tourism comes with a high cost. We should all keep it in mind.",,[3]
bpbillboard,"Honest and quick question... please answer truthfully:

Do you think our #BLINK fandom is slowly dividing..?

It upsets us because most HAVENT fixed their behaviour from last time and I don’t know how much damage it cost to this family.

@ygofficialblink #BLACKPINK",,[3]
BJMama1999,"Being #mindful of how your team is FEELING can help you get in front of problems before they cost too much time, money and damage!  See how #BJCC can support you and your most valuable resource...your people!
#Wellbeingculture #MentalHealthMatters 
https://t.co/MAA0eywS5m",,[3]
OhMarieTurner,"Why is it that we only give a rats-ass about an invisible disease when we lose organs?! 
Endo has caused me some pretty horrific organ damage - and almost cost me them. We know what organ death feels like! https://t.co/buV4RYUcOG",,[3]
Chezer59,"With a carbon tax, the real cost of carbon fuel would = cost of fuel + carbon tax + lower healthcare and disability costs + less environmental damage.

The incentive to use alternative fuels would compound savings &amp; improve quality of life.

#pnpcbc #cdnpoli #onpoli",,[3]
phugor,"Hearthstone - Tavern Brawl 164 - Valeera's Bag of Burgled Spells

Valeera has stolen spells from every class and filled your deck with them! Each of those spells will summon a random minion of the same cost when played.

Rogue Turn 6 - 23 Damage Win

https://t.co/srjEW8ixKl",,[3]
Chezer59,"The carbon tax moves more of the real cost of carbon fuels up front, to encourage the use &amp; development of alternatives.

The actual cost is the same, fuel price + taxes that are needed to offset the damage done.

Pay me now or pay me later.

#cdnpoli #onpoli #pnpcbc https://t.co/0aR00bfGKY",,[3]
maxsec,@irongeek_adc Plus they do a full on accidental damage package. You ring up and they fix onsite normally next day. Again adds $$$$ but gives peace of mind. My 1920x1080 i7/512gb m.2 and 16gb with three year accidental cost me about £1350 ex tax as I get the tax back as a business,,[3]
CJam101,"@ElectrekCo @FredericLambert Eat 💩 VW.. till they produce a sincere apology and make real reparations for the damage they’ve done through straight out lying and cheating in order to make a profit at the cost of people’s lives.. I say this as a past owner of more than a couple Audi’s that I loved, eat 💩 VW",,[3]
Lysairvine11,"@trafficscotland Not harsh, I agree. However, if said Deer should die upon impact,  is it legal to throw it in the boot to take to the local butcher?  And who's responsible for the cost to repair the damage to the car? 🤔 Insurance Co?
#askingforafriend",,[3]
Chezer59,"The carbon fuel industry has enjoyed an environment damage cost exemption for too long.

Businesses that depend on this exemption have also benefited.

The Carbon Tax doesn’t change the cost of carbon fuels, it only changes who pays, and when.

#cdnpoli #onpoli #pnpcbc",,[3]
LlysseWylle,"@SenatorBobBeach Ah! I wasn’t attacking, so I wasn’t looking for a defense. My bad.

To clarify, I don’t generally support things that impose a disproportionate cost on working folks here, w/no benefits. As I exp. in the post, I’d like to see the companies causing the damage pay for the damage.",,[3]
sspmayor,RT @WestStPaul: @Fleur_de_Lis23 @sspmayor @DakotaCountyMN @sspmayor is right. It's a County road &amp; roundabouts. Unfortunately the cost to m…,"@Fleur_de_Lis23 @sspmayor @DakotaCountyMN @sspmayor is right. It's a County road &amp; roundabouts. Unfortunately the cost to maintain landscaping inside is actually very high. Between running irrigation lines out there &amp; weeding to salt damage &amp; snow pack in the winter, it's just not in the budget for the City to take over.",[3]
DickTrumpy,"@PressSec @realDonaldTrump 45's a liar &amp; criminal. If justice prevails, he'll be forced out. If the complicit GOP prevails, they'll protect their power at the cost of USA rule of law. Most trumpbots will rejoice. Very few idiot followers are willing to honestly confront the larger damage to our principles.",,[3]
MarkH00K,"@Beerb1tch @ink1402 @LidlUK Yes, it’s weighing up the “cost” of wrapping against the “cost” of waste/damage.
“Cost” being both £ and environment.",,[3]
ATLpro,"Homeowners in and around Metro Atlanta whose homes received Hail or Wind Damage may qualify for claim assistance for roof repair OR even a brand-new roof at no cost to you.
Call us for a free inspection 
📞🔺️404... https://t.co/koFzAY2O1n",,[3]
devinefuture,@uhaul's insurance co RepWest has denied the claim &amp; the right to appeal &amp; suggested that we sue the co. What they don't realize is that this will cost them more than fixing the damage to the car so anyone have attorney referrals? DM. Thanks,,[3]
Carbon_Response,"Global Carbon Loss Index (CLIX) is 14.59 USD/tonne CO2 as at 2018-08-02. CLIX carbon pricing factors in the true cost of damage caused by CO2 emissions – past, present and future.",,[3]
AltaDentalCare,One of the most unpleasant dental experiences is having gum disease. Gum disease is a growth of bacteria in your mouth that cost your teeth and gums to damage the surrounding of your teeth. Here are the Lifestyle changes that can help prevent gum disease: https://t.co/KnvdLdtUHQ https://t.co/EFDhkITBsk,,[3]
JosephineMaui,"Yes, its actually happening. Learn how automated armies of social media bots attack brands (just like yours) with targeted messages that can potentially cost companies millions of dollars through damage to their reputation. https://t.co/iNg1gv1a6E",,[3]
JerrySeeker,"@kcranews The Trump Organization should pay for California's wildfire damage. The cost to Trump would be tiny compared to the harm he has caused to CA, the US, and the world.   🌊🌊🌊",,[3]
NotASithLord,"@ProficieNtOCE @el33th4xor It's never free to attack Bitcoin, there's always at least opportunity cost. Mining is only becoming more and more commoditized, and even with a large amount of hostile hash power, UASF and Segwit2x proved users are in control and the damage that it can cause is minimal.",,[3]
Dreadpirate42,"@PATRIQT_1776 @swnsasy @bleudawn7 @Cha51brolll19 @42Gnome @jdd2169 @OperationJust @104SONADOR @Utleyjacobite @Talieb3 @BBackerman1 @AntiRacism4Eva @Jessicap527 @jhchilcutt @AngryandAsian @KweenofNoize214 @SafiMaasai @AnonymissFire @AMluvinit2 @AWorldOutOfMind @ad_gent2012 @arkreader @AltfactsUSA @TheChickLivesOn @SDDNP @AnthonyHopeNYC @anapaula551155 @altdave721 @aLiciaLokita512 @Aleja_gria @AdvisorAkbar @AntonioParis @AmyCA0214 @amywithacavy @a35362 @aes87 @aviduser @Katpa73 @Nuria_amb_seny @geekyginge @tundrawolfqueen @SassyMsViolet @doneaGHOST @therealroseanne @SenSanders @realDonaldTrump @CNN @infowars @EPA There's addressing it, and there's making it worse. Trump, as always, is making it worse. 

And this still doesn't address my original point - where is the cost vs benefit analysis. You claim this will magically improve things, but will it even make up for the damage its done?",,[3]
RubyRtalent,I liked a @YouTube video https://t.co/s5XPony8VG How To Soundproof Your Walls With No Damage For Low Cost,,[3]
jas_glos,"Damage limitation is key as Brexit plan would cost £500 per person a year
  #brexit #gloucester 
 https://t.co/D3gfCAdxBR",,[3]
andrew_liggins,"@cl78332172 There’s also millions spent every July in bonfire damage control, police &amp; emergency services overtime, and repairing damages to council property over the marching season.  Much much more a year than what an ILA or US act would cost.",,[3]
acpfl1,We cater to your plumbing needs 24 hours daily. We offer a plumbing home safety inspection to determine any possible leaks or water damage for the low cost of $25. Call Us Today!,,[3]
ServproNLaredo,"Commercial Water damage can not only cause building damages but also can cost your business revenue. Call us we can get you back in business sooner than you think!
https://t.co/0nOELUPhhj https://t.co/2dtvmzCoIw",,[3]
dhunterprint,"#documentsecurity Counterfeit and fraudulent documents can cost lost revenue, counterfeit attacks can damage company brand, future sales and customer service. Select Services offers a full line of covert and overt options for document security. https://t.co/QYfcnNRz3e",,[3]
Ditha23,@Serenity_Later @DD2705 @alancaw While there is not many permanent examples I would guess that is due to the damage rugby does to a pitch compared to soccer. The aviva is available anytime a team wants it. The cost is the biggest factor,,[3]
rezo34947638,"@Rentmotors As you know your client had car exident with me in Georgia. It was his fault and he paid to you 2000$ to your company. We, me and your agent made agreement and made a contract. you have to  Compensate all for  car damage and for Treatment cost. as I know as your Agent",,[3]
SalesAssDiary,FOR FUCK SAKE @DPD_UK  the lengths of despair you force customers to go to!!! I’m expecting a full refund on my delivery cost and for any damage caused to my stock,,[3]
Lauraa_jade,This is the “damage” I’ve caused to my room to cost 300 quid 😭😭😭@baskeys_lets NO STUDENTS GO WITH THEM EVER !!!! https://t.co/nXyZZQTdcU,,[3]
niamcbride,"RT @StateAuto: Did you know the average cost of a home water damage is almost $7,000? With the @smartroost Smart Leak Detector, you can hav…","Did you know the average cost of a home water damage is almost $7,000? With the @smartroost Smart Leak Detector, you can have peace of mind. Now available for new Ohio and Illinois customers! https://t.co/LjNuVgspA3",[3]
texasinsider,"RT @txglo: Don't wait until it's too late to get flood insurance. 
Just one inch of water can cost at least $27,000 in damage. 
#BePrepared…","Don't wait until it's too late to get flood insurance. 
Just one inch of water can cost at least $27,000 in damage. 
#BePrepared #FloodFacts https://t.co/QzwtEO55FS",[3]
WestStPaul,"@Fleur_de_Lis23 @sspmayor @DakotaCountyMN @sspmayor is right. It's a County road &amp; roundabouts. Unfortunately the cost to maintain landscaping inside is actually very high. Between running irrigation lines out there &amp; weeding to salt damage &amp; snow pack in the winter, it's just not in the budget for the City to take over.",,[3]
Friday13,"@Threeshotgamer @XpandDong @DiversityAndCmx @TheQuartering @greg_doucette Of course, you'd think that with the property damage, the bar'd want the guy ID'd as well so they can recoup the cost of repair/replacement.

Makes me wonder just how much the bar staff was involved in this, since they ACTUALLY TRIED TO KEEP JEREMY FROM CALLING THE COPS...",,[3]
WillMooreSD,Today's unanimous CA Supreme Court decision is a throughgoing repudiation of the stunning arrogance of some of our past and present city leaders.  It will cost us all a fortune to repair the damage their lawless right-wing fervor has done and that stain will mar their legacies.,,[3]
baltree,"RT @bob42156: Beyond the environmental damage, the cost of higher gas prices (supply and demand) and less gas efficiency will make cars mor…","Beyond the environmental damage, the cost of higher gas prices (supply and demand) and less gas efficiency will make cars more expensive to own and operate.   https://t.co/D1ZIH9Zz4o",[3]
sovietblobfish,"like, living in the place doesn't cost them shit, unless you damage something, but then they charge you for that separately

how can anyone thinking paying thousands a year for the right to occupy a space is justified?",,[3]
maidenvoyageccg,"FAUSTUS COMPENDIUM /// Click here to check out this ominous grimoire found in the Warlock deck. When a Witch activates this grimoire she can enhance the damage output of an allied Witch &amp; ensure the damage is completely unabsorbable. Surely, this kind of power comes at a cost. https://t.co/eeI1spDax5",,[3]
RachelOLindley,"RT @celizario: NEW: @TPWDnews says damage to the Balmorhea State Park pool was caused by ""years of undermining erosion."" Repairs to the poo…","NEW: @TPWDnews says damage to the Balmorhea State Park pool was caused by ""years of undermining erosion."" Repairs to the pool will cost $2 million and take ""several months"" to complete. https://t.co/EQJtDw0dlc",[3]
cassandrahaslem,It’s a wonderful Thursday morning and I just discovered that that weird sound I’ve been hearing ever since my Heber car wreck in 2016 is actually damage to my car’s insides (not just the $1007 in cosmetic damage.) It’s going to cost me nearly another $1000.,,[3]
teakve,"RT @BrookingsGlobal: “In the U.S., we will often be handing traumatized children back to traumatized parents, particularly since many famil…","“In the U.S., we will often be handing traumatized children back to traumatized parents, particularly since many families—prior to separation—experienced grave trauma at home and on the journey to the border."" https://t.co/8HbY3ow9EI https://t.co/PcbzhcZaDl",[3]
SooeyK,@spaceangel1964 @MellowOchre @GaryLineker @Aiannucci @Tony_Robinson @sarahwollaston @Women_4_Europe @NicolaSturgeon @Anna_Soubry @CCHQPress @OFOCBrexit @LeanneWood @CommonsEUexit @HoCpetitions @Labour4EU @chunkymark Yup. Doesn’t matter what damage is done- this Tory vanity project has to be pushed through no matter what the cost 🤨🤦‍♀️,,[3]
bob42156,"Beyond the environmental damage, the cost of higher gas prices (supply and demand) and less gas efficiency will make cars more expensive to own and operate.   https://t.co/D1ZIH9Zz4o",,[3]
234seconds,"@Gitanja02603013 a second of thought before we like or RT or even tweet, will solve all the crisis. For ex: I loose control on stalin trolls. I cant resist joining. But that doesn't cost, bcoz he is everyone's enemy. But when we troll other stars, it causes damage. SO lets apply our mind b4r RT",,[3]
celizario,"NEW: @TPWDnews says damage to the Balmorhea State Park pool was caused by ""years of undermining erosion."" Repairs to the pool will cost $2 million and take ""several months"" to complete. https://t.co/EQJtDw0dlc",,[3]
Rathee_C,Can institutional intervention make plastic producers to internalise the cost of environmental damage. Responsible manufacturing and responsible consumption can be a answer !,,[3]
Zillion29,"@RyanAnnan @JoeNBC @morningmika If you paid attention, you saw that they focused on the administration's response and leaders comments on the damage and cost.   They didn't say a word about individual people.",,[3]
CPPP_TX,"The deadline for baseline budget requests from Texas agencies is at the end of this month. More from @DeLunaEva: ""Putting the 2018-2019 State Budget on More Solid Ground"" https://t.co/2Glyn2k6GD  #txlege",,[3]
SpartanRoof,"Just two girls 👯‍♀️ on a roof. Nothing to see here 😉

How can we HELP YOU?????

Old Roof? Missing Shingles? Lifted Shingles? Torn Shingles? Granular Loss? Leaks? Hail Damage?

Call us for your No Cost Inspection                
☎️ 281-782-9422 ☎️ https://t.co/Ze7A5pSUSd",,[3]
capgaznews,"Getting branches caught in a propeller likely will cost the boat owner more time than normal, as repair jobs stack up at service shops because of debris on area waterways. https://t.co/GcMLqFKtSd",,[3]
Gajendraag76,"RT @AjayendraR: अखिलेश के बंगले में तोड़फोड़ से 10 लाख का नुकसान, होगी रिकवरी https://t.co/ZjFfqtoMgV","अखिलेश के बंगले में तोड़फोड़ से 10 लाख का नुकसान, होगी रिकवरी https://t.co/ZjFfqtoMgV",[3]
where2executive,"@wolfman_55 @DeborahMeaden I wasn’t upset about the result, but I am really upset about the damage done so far, and the threat of a no deal brexit, which on one voted for. We did not vote to leave at any cost !!",,[3]
NEBiolabs,"What is the mutagenic cost of replicating past a thymidine dimer lesion in vivo? Check out @NEBiolabs scientists (JOng &amp; VPotapov) recent @CellReports collaboration with a group from the #DNA Damage Tolerance @CNRS (AIsogawa, RFuchs &amp; SFujii) in Marseille. https://t.co/Ln8a1wVlei",,[3]
GaiaSharbel,"This administration is eroding the social cost of carbon values: the health &amp; environmental damage caused by emissions because of greed $$. Trucks &amp; SUVs are more profitable, GM earns $35,000 profit for each $73,000 Escalade sold, but an electric vehicles are half as profitable",,[3]
davejavupride,"@AppleSupport Unfortunately, the cost is £280 here in the U.K. to replace screen. (Which I can not afford) My major gripe is the level of damage sustained due to a genuinely very minor scrape along a wall. This does not align with expectations of robustness at all.",,[3]
NH4youth,RT @BrookingsInst: Some of the migrant children who have been reunited with their parents are already exhibiting signs of trauma. Why that…,Some of the migrant children who have been reunited with their parents are already exhibiting signs of trauma. Why that could have a lasting impact: https://t.co/lQUEDfWXBO https://t.co/2xOh6fxSgl,[3]
mrsdrpepper76,So glad I paid my dentist $2700 three months ago for a crown on my tooth. Today I have a massive spreading infection that started under that crown. Going to cost thousands more to repair the damage 😡😡😡,,[3]
StateAuto,"Did you know the average cost of a home water damage is almost $7,000? With the @smartroost Smart Leak Detector, you can have peace of mind. Now available for new Ohio and Illinois customers! https://t.co/LjNuVgspA3",,[3]
BrookingsGlobal,"“In the U.S., we will often be handing traumatized children back to traumatized parents, particularly since many families—prior to separation—experienced grave trauma at home and on the journey to the border."" https://t.co/8HbY3ow9EI https://t.co/PcbzhcZaDl",,[3]
Isaythere,RT @JimmyKrebs4: @CNN Ok TSA cutting back on security is a green light for terrorist. A small aircraft can do as much damage as a large air…,@CNN Ok TSA cutting back on security is a green light for terrorist. A small aircraft can do as much damage as a large aircraft! Saving money at the cost of human lives. This administration does not have the US Citzens best interests at heart.,[3]
Dr_G_Enigma,"RT @AltSpaceForce1: @Amy_Siskind R's should vote for @BetoORourke bet
This would remove a valuable character from @StephenAtHome show @Cart…","@Amy_Siskind R's should vote for @BetoORourke bet
This would remove a valuable character from @StephenAtHome show @CartoonPres
This would damage the show, cost Colbert $ &amp; credibility and inflict embarrassment. 
What better way to own the libs is there?
#Qanon knows this is true. https://t.co/lJzx4StKtg",[3]
ValleyCAN,"RT @e2org: The Trump admin's decision today rolling back #fueleconomy standards will cost US jobs and economic growth, damage industry comp…","The Trump admin's decision today rolling back #fueleconomy standards will cost US jobs and economic growth, damage industry competitiveness in global markets https://t.co/O6FMtKFkfz #CleanerCars",[3]
e2org,"The Trump admin's decision today rolling back #fueleconomy standards will cost US jobs and economic growth, damage industry competitiveness in global markets https://t.co/O6FMtKFkfz #CleanerCars",,[3]
Kurtis_Pittman,"@ClashRoyale for royal recruits, the simplest balance would be to change Elixir Cost to 7. Or keep the elixir cost and instead buff their health and damage by 6%",,[3]
Maaani__,UVA &amp; UVB rays age your skin at about 85% the rest is genetics !!! 😩😩😩 It’s hard to REVERSE sun damage &amp; cost A LOT of money &amp; treatments !!!,,[3]
MethaneTrust,"Algae likely to cause damage to boats 

https://t.co/o4u4XTvYPp #cyanobaceria #damage to #fibreglass + #wooden #boats #Florida #algae #cost",,[3]
AltSpaceForce1,"@Amy_Siskind R's should vote for @BetoORourke bet
This would remove a valuable character from @StephenAtHome show @CartoonPres
This would damage the show, cost Colbert $ &amp; credibility and inflict embarrassment. 
What better way to own the libs is there?
#Qanon knows this is true. https://t.co/lJzx4StKtg",,[3]
KATLocksmiths,"A small demonstration by Keiran on picking a night latch. This customer had locked her keys in the garage and door had a night latch rather than a traditional lock. Keiran was able to pick it open without damage, saving the customer the cost of a new cylinder #keepingesssexsafe https://t.co/U35DIyhasT",,[3]
Amit10913375,"RT @News18India: टीम ने राज्य संपत्ति अधिकारी को 266 पेज वाली जांच रिपोर्ट सौंप दी है..
https://t.co/Jd0ashw9KE","टीम ने राज्य संपत्ति अधिकारी को 266 पेज वाली जांच रिपोर्ट सौंप दी है..
https://t.co/Jd0ashw9KE",[3]
txglo,"Don't wait until it's too late to get flood insurance. 
Just one inch of water can cost at least $27,000 in damage. 
#BePrepared #FloodFacts https://t.co/QzwtEO55FS",,[3]
Rickylee50,@SarahPalinUSA That is no surprise! They want their votes! The democrats would rather flood this country with illegals and careless about the cost and damage that American tax payers get stuck with!,,[3]
West221B,"@D_B_Harrison A finer point:

Sin's damage was a done deal ~6,000 years ago at the Big Chomp

Our sin did not cost Jesus His life--that would make us gods
Jesus voluntarily laid His life down so that believers will live
This is ""Good News""

""Go and do likewise""

#GraceAlone",,[3]
SkinLessYT,"@ChillyRoom Brick rage - Gashapon
Attack Method - throw 1 brick next brick will be shot in 0.9 seconds - then 0.8 - until it reaches 0.2seconds  (change color to red the more you shoot)
Attack starting at 1 every brick +1 until 5 damage
Energy Cost 1
Crit Rate 50%
Inaccuracy 20%",,[3]
CraigBeachler,Cost of my former vehicle. I realize this type of vehicle is/was a choice as well as where I live and what I pay for parking. These are variables for others.  $622 @Lexus $84 penalty fees (mileage overage + damage) averaged over 36 months. $58 @GEICO,,[3]
Martin44418334,@SheilaGunnReid How much is that damage to hotels going to cost us now? How about the damage done to our student's dorms? When the post-election audits are complete I expect charges laid against Trudeau &amp; his gang of thieves!,,[3]
detroit1051,"@sveng I'm worried about the damage Trump is doing to our country. Climate change is real. 
 https://t.co/CF2ZO1EHym",,[3]
