MoreTeaDebra,RT @GaryDelaney: It’s estimated the cost of the damage could be in the hundreds and thousands. https://t.co/4x5ALUOI9u,It’s estimated the cost of the damage could be in the hundreds and thousands. https://t.co/4x5ALUOI9u,[3]
linny55,RT @justeconomics: This is a superb and accurate reflection of Ireland by Juno McEnroe. Varadkar's government hates the people and loves th…,This is a superb and accurate reflection of Ireland by Juno McEnroe. Varadkar's government hates the people and loves the corporate sector. People are just collateral damage and cost in FG neoliberal minds Tax-break Ireland is no country for the vulnerable https://t.co/JvkBpsFI3f,[3]
Jibsman1,"@RealEdmeji I hope she has a few things to cover the cost of the damage because we're trading everything available 😂. 

And... 

If she no get money she get place to borrow 🎶",,[3]
dk_peace,@realDonaldTrump No one thought that calling Canada a security risk and starting a trade war was a good idea. The damage to other sectors of our economy and to our international reputation are too high a cost.,,[3]
BrakeQuipLancs,"When your car is trying to tell you something, don’t ignore it. If you postpone repairs, you risk additional damage that can cost hundreds or even thousands of dollars to fix. https://t.co/FwnhQOxO17",,[3]
cathayschris,The crisis of underfunding crucial local public services is getting deeper. The damage being done will last years. It's short sighted as well as wrong - the human &amp; financial cost will be paid for a long time. https://t.co/NTc6I6FED5,,[3]
winnyooms,"RT @stefaniei: An exhaustive new study focusing only on heat-related damage reaches a sobering conclusion: by the year 2099, even with econ…","An exhaustive new study focusing only on heat-related damage reaches a sobering conclusion: by the year 2099, even with economic growth and adaptation, 1.5 million more people will die each year around the world because of increased heat. https://t.co/Ag6EyG0xGn via @WSJ",[3]
Amel_Benmann,"Hogs run wild and wreak havoc on farms but USDA redoubling efforts to fight problem: Wild hogs are in at least 39 states and cost up to $2.5 billion annually due to the damage they cause farmers and other industries, but the USDA is fighting back and may… https://t.co/jzP4z6CL6h https://t.co/BqLTRmvydk",,[3]
Dowellenough,@HannahQuirk1 @PenelopeGibbs2 ... or perhaps we should introduce the legal advice at the earliest possible moment. The initial outlay would be worth the benefits of avoiding the terrible societal damage that is cost of getting things wrong?  *noting that in this case that happened.,,[3]
exlo_alkoot,"@SophiaCannon @BashaR_aljazzaf any other phone get battery damage if it gets over charged except for the iphone because in iphones there‘s a technology that sends back the extra power to the cable so the cable gets damaged instead of the iphone battery, the cable cost 10$ while the battery cost 60$ thanx apple",,[3]
LinesDavid,"@AgricSimon @MaddeverAndrew Seems about right, plenty of beans but very small but virtually no bruchid damage on unsprayed crop.
Think s beans might just cover cost of harvesting",,[3]
AlimonteLina,"RT @shilohwalker: @GovHowardDean @herhandsmyhands Counseling can help and it should be offered and started immediately, at no cost to the p…","@GovHowardDean @herhandsmyhands Counseling can help and it should be offered and started immediately, at no cost to the parents. @realDonaldTrump @jeffsessions @SecNielsen should be held responsible for the damage they imparted on those kids &amp; should be the ones accountable for the help the families will need.",[3]
justeconomics,This is a superb and accurate reflection of Ireland by Juno McEnroe. Varadkar's government hates the people and loves the corporate sector. People are just collateral damage and cost in FG neoliberal minds Tax-break Ireland is no country for the vulnerable https://t.co/JvkBpsFI3f,,[3]
DAGauteng,"RT @DA_JHB: ""Under the ANC administration, the City did not replace infrastructure until it actually failed in an effort to save money. Thi…","""Under the ANC administration, the City did not replace infrastructure until it actually failed in an effort to save money. This meant knock-on damage to other infrastructure - which cost even more to replace."" - MMC @NicoDeJager64  #DAdelivers",[3]
brunty7,RT @ritustweets: Hi @Lendleaseuk NOW would be a really good time to show you truly understand Corporate Social Responsibility. The enormous…,Hi @Lendleaseuk NOW would be a really good time to show you truly understand Corporate Social Responsibility. The enormous damage you are doing to your reputation will cost a LOT more than £3-4mil to fix. #CladdingScandal #LeaseholdScandal https://t.co/JiiNPMBtyT,[3]
IficialArt,"@NeilMcMahon @plalor @laurenetrim Ok compassion is always good, but I’m sure you know - lawyers will seek a review of every arrest this guy has made. Criminal cops damage more than their own careers when their caught.  This can cost NSW a good deal of money and sullies the name of professional cops in nsw.",,[3]
PokemonItems,Babiri Berry: Half the amount of damage taken by super-effective moves. Can be found under 'Berries'. Cost: 20 Pokédollars.,,[3]
Fallenberg,"Hogs run wild and wreak havoc on farms but USDA redoubling efforts to fight problem: Wild hogs are in at least 39 states and cost up to $2.5 billion annually due to the damage they cause farmers and other industries, but the USDA is fighting back and may… https://t.co/NdaFgNJV9J https://t.co/XSVtALRkvV",,[3]
KHillsmith,"@Jacob_Rees_Mogg Try asking Walsh the financial cost has been to BA, Easyjet so far thanks to your Brexit ideology. Not to mention sending Monarch Airlines bust.  But people like you and your followers do not care about the damage you inflict to get what you want.",,[3]
HillbillyTruth,"@azcentral @MeghanMcCain We will be better without him!  That sorry POS has cost America numerous lives and a trillion dollars for his little Obamacare Tantrum!  A Damn Trillion dollars!  Think about 1 man causing so much damage, oh wait the aircraft carrier!   Either in denial, or Maxine level IQ",,[3]
Double__Click__,"Hogs run wild and wreak havoc on farms but USDA redoubling efforts to fight problem Wild hogs are in at least 39 states and cost up to $2.5 billion annually due to the damage they cause farmers and other industries, but the USDA is fighting back and may get more money from C…",,[3]
xpaintitblack7x,"Just narrowly avoided a disaster that could have caused lots of property damage and even could have cost the lives of my pets, my mom, sister, and/or myself. I don’t think I will be getting much sleep tonight 😰",,[3]
Chrismarcel,"RT @copyconstruct: ""the whole point of [actual] distributed systems engineering is you assume you're going to fail at some point in time an…","""the whole point of [actual] distributed systems engineering is you assume you're going to fail at some point in time and you design the system in such a way that the damage, at each point is minimized, that recovery is quick, and that the risk is acceptably balanced with cost"" https://t.co/ZHz7ZqlVLi",[3]
auldnate,"@WontMarch4Soros …Healthy ppl get hit by cars too. You might not have Cancer today, but the future is uncertain. I was 22, &amp; in excellent health when I found a #BrainTumor in my head that cost# $450K to remove &amp; repair the damage. I was just lucky, &amp; my Dad had a policy that covered my care…",,[3]
DA_JHB,"""Under the ANC administration, the City did not replace infrastructure until it actually failed in an effort to save money. This meant knock-on damage to other infrastructure - which cost even more to replace."" - MMC @NicoDeJager64  #DAdelivers",,[3]
_ChosetoLive,"@GhostARCTroop She winced, barely able to see the wreck of the ship behind her. The young Pantoran didn’t need to see the damage to know what was true: she had been the only survivor in an attack that had cost her two of her most trusted advisors.

Riyo tucked her head down, sighing.",,[3]
WagnerMomma,"@MarkDav65721158 @FirestormRdr @realDonaldTrump Yes, he has made some headway with NK but at what cost?  He is causing more damage to our nation and its resources than we can truly sustain.  If that is making America great, all I can do is weep for our once great nation that he is tearing apart piece by piece.",,[3]
NewsDingo,"Wild hogs are in at least 39 states and cost up to $2.5 billion annually due to the damage they cause farmers and other industries, but the USDA is fighting back and may get more money from Congress.
https://t.co/hXQPcM7Dz6",,[3]
twoscoopsplease,@realDonaldTrump Wow. She literally colluded with a Chinese spy for 20 years. I can’t imagine the secrets and damage that cost our country. Let’s all watch as the fake news media fails to cover this bombshell story.,,[3]
LFiggy78,"RT @CPPP_TX: The deadline for baseline budget requests from Texas agencies is at the end of this month. More from @DeLunaEva: ""Putting the…","The deadline for baseline budget requests from Texas agencies is at the end of this month. More from @DeLunaEva: ""Putting the 2018-2019 State Budget on More Solid Ground"" https://t.co/2Glyn2k6GD  #txlege",[3]
shilohwalker,"@GovHowardDean @herhandsmyhands Counseling can help and it should be offered and started immediately, at no cost to the parents. @realDonaldTrump @jeffsessions @SecNielsen should be held responsible for the damage they imparted on those kids &amp; should be the ones accountable for the help the families will need.",,[3]
NippySweetyLass,RT @AyatGhilmeini: the last couple of days have seen the defenders of the real labour party hit Corbyn and his lenninist antisemite pals so…,"the last couple of days have seen the defenders of the real labour party hit Corbyn and his lenninist antisemite pals so hard that he is now doing political damage control. no matter the cost, Corbyn must be made to fail. He is evil, the magnetic pole for Jew-hate on the left. https://t.co/bJl152ApTf",[3]
parvez1,"RT @harvardmed: As a vascular surgeon at @The_BMC, Alik Farber is adept at assessing and addressing the damage caused by conflict and traum…","As a vascular surgeon at @The_BMC, Alik Farber is adept at assessing and addressing the damage caused by conflict and trauma https://t.co/qW2e6DkV2d",[3]
Misshoneybunbun,Hey guys I’ve had somethings happen and need HELP I Had to take my dog to the emergency vet and found out that he has some pretty bad nerve damage so on Monday he will be getting an MRI which is gonna cost me about 1000 so I’m trying to sell off characters and possessions and my https://t.co/Ba9dHiAYEh,,[3]
Jungkook_0197_,"RT @bpbillboard: Honest and quick question... please answer truthfully:

Do you think our #BLINK fandom is slowly dividing..?

It upsets us…","Honest and quick question... please answer truthfully:

Do you think our #BLINK fandom is slowly dividing..?

It upsets us because most HAVENT fixed their behaviour from last time and I don’t know how much damage it cost to this family.

@ygofficialblink #BLACKPINK",[3]
MizuwolfWolfy,"@TFCSr @OrbitInDarkness @BoomRoasted6 - the costs of damage caused by climate change, like the destruction of infrastructure due to more severe and frequent storms, the cost of moving water further and further to places that use up all their groundwater, etc etc.",,[3]
trevortombe,"@mrbinnion Fair enough. Will disagree with you on the first point, but that’s my free market bias coming though. Perhaps we can both agree that we should only lower emissions if the cost per tonne of doing so is lower than the environmental damage associated with it?",,[3]
RozayinXD,"@HavocGaming_YT @ClashRoyale If Golem cost 7 elixer but death damage decreased by half, would it still good?",,[3]
GaryHavir,"Water and related damage accounts for 45% of home claims (Information Insurance Institute.) Regular checks and maintenance can help you avoid the cost, cleanup and inconvenience of water damage to your home &amp; possessions. Safeguard your home &amp; valuables! https://t.co/8lhZWuuHeC",,[3]
darthskeptic,"""Voldemort has taken control of England. Orders?""

""Launch nuclear missiles. Turn the country into ash and glass""

""What?""

""It would cost too many lives and bullets to liberate England. Innocents are collateral damage. We must contain the threat 

#HarryPotter40k

@alain_hardy",,[3]
YouGetItRight,"@CaptainJaneway6 @tjohnwez @Channel4News @realDonaldTrump Idk about Russia but America is going to suffer a great damage, especially those poor and vulnerable. The republicans agenda is to deliver more money for the rich at any cost.",,[3]
DavidLakhan2014,"RT @AlanCane604: Trudeau's putting the ""irregulars"" up in hotels which are still complaining about the damage the last bunch cost. Meanwhil…","Trudeau's putting the ""irregulars"" up in hotels which are still complaining about the damage the last bunch cost. Meanwhile, we have Canadians living in tent cities in Vancouver and they have to supply their own tents.  #trudeau",[3]
AlanCane604,"Trudeau's putting the ""irregulars"" up in hotels which are still complaining about the damage the last bunch cost. Meanwhile, we have Canadians living in tent cities in Vancouver and they have to supply their own tents.  #trudeau",,[3]
bdnews24,"Hogs run wild and wreak havoc on farmers but USDA doubling efforts to fight problem Wild hogs are in at least 39 states and cost up to $2.5 billion annually due to the damage they cause farmers and other industries, but the USDA... https://t.co/gXkyhOoriW via @bdnews24 #business",,[3]
DarliFong,RT @TNAMCOTEnglish: Ten fire trucks rushed to put out the blaze at Wat Klang Woraviharn temple  in Samut Prakarn before dawn. The fire occu…,Ten fire trucks rushed to put out the blaze at Wat Klang Woraviharn temple  in Samut Prakarn before dawn. The fire occurred at almost 100-year old teak house for monks. No one was wounded and the damage is estimated to cost at least one million baht. @TNAMCOT https://t.co/LmzVCTbA9Q,[3]
L_Gordito,"RT @A_Dilettante_: One major surgery can cost $30,000. Breaking your leg can take two or three surgeries depending on how bad the damage is…","One major surgery can cost $30,000. Breaking your leg can take two or three surgeries depending on how bad the damage is. Y’all taking $90,000 in surgeries on the chin? I doubt it.",[3]
Michell73425880,RT @blogpreston: Damage was caused to grills and brickwork as they tried to force entry to the flats: https://t.co/sOlUNnmvSj https://t.co/…,Damage was caused to grills and brickwork as they tried to force entry to the flats: https://t.co/sOlUNnmvSj https://t.co/VWVdmmwPnT,[3]
CoalitionTechYT,"@V3Temptation Yeah sorry man, the last PC I shipped ended up driving overall cost past my budget AND I had to ship it partially disassembled to completely avoid any shipping damage.",,[3]
christylemon,"@realDonaldTrump @FoxNews LIE: We're fixing some of the worst trade deals. 

 FACT: Trump has cost the stock market an estimated $1.25 trillion in value with tough trade talk. 

 FACT: J.P. Morgan's ""If uncertainty hangs over the market for a extended period of time, the damage becomes more permanent.”",,[3]
mingoaka,This construction site cost me $2200 worth of damage to my car 🙃 https://t.co/16hh8jOaZF,,[3]
PMTExteriors,"Have you recently had a hailstorm through your neighborhood? Uncertain if you have any damage? Give us a call today to schedule your honest, no obligation storm damage inspection today at no cost to you. https://t.co/aRFlkegRLH",,[3]
drmcdonald55,"RT @bsc_urology: In one study, cost analysis of #LithoVue reveals potential savings in some cases: ""Urologists may wish to use the single-u…","In one study, cost analysis of #LithoVue reveals potential savings in some cases: ""Urologists may wish to use the single-use scope for cases in which reusable scope damage may occur, in particular in cases with lower pole and staghorn stones."" https://t.co/KhBqs15q68 https://t.co/SMnu2ZOkEq",[3]
pedwards2014,RT @Goodixlady: #PNG villagers count huge cost of damage from #logging https://t.co/7sCL2hngVO,#PNG villagers count huge cost of damage from #logging https://t.co/7sCL2hngVO,[3]
Goodixlady,#PNG villagers count huge cost of damage from #logging https://t.co/7sCL2hngVO,,[3]
mcassara143,"RT @JerryLingle: The pity is, the GOP are willing to follow ANYTHING that promises them money and power regardless of the cost, regardless…","The pity is, the GOP are willing to follow ANYTHING that promises them money and power regardless of the cost, regardless of the damage to America.

#TrumpTREASON The GOP LIVES proven LIARS",[3]
rusticles1136,@TheRumHam_CR @ClashRoyale Nerf hog rider it has too much health and does too much damage for a 4 cost one of those two things has to change because every every single person in ladder almost is running hog rider and it's very frustrsting because all the decks are is bridge spam,,[3]
CDW_Healthcare,"The cost of breaches in #healthcare is high — not just due to network damage or data theft, but rather to the loss of reputation that leads to a lack of info, strained relationships w/ other biz, edu and a loss of customers. Learn more via @HealthITnews: https://t.co/nqyikv2WFU",,[3]
JerryLingle,"The pity is, the GOP are willing to follow ANYTHING that promises them money and power regardless of the cost, regardless of the damage to America.

#TrumpTREASON The GOP LIVES proven LIARS",,[3]
T_Neliton,"RT @cornholio74: @saladinahmed Stealing babies/ children is bad!
#CGI #CF #Haiti #LauraSilsby #HRC (RIP #MonicaPetersen) 
#ChildTrafficking…","@saladinahmed Stealing babies/ children is bad!
#CGI #CF #Haiti #LauraSilsby #HRC (RIP #MonicaPetersen) 
#ChildTrafficking? #DonationMoney? #MiningContract?

https://t.co/zZe6f7d060

https://t.co/WaE1uYsuSp

https://t.co/ETCfI5y34O

https://t.co/KB5A5aOlcA https://t.co/AyA4OgVF0G",[3]
blogpreston,Damage was caused to grills and brickwork as they tried to force entry to the flats: https://t.co/sOlUNnmvSj https://t.co/VWVdmmwPnT,,[3]
AreUKiddingMe33,"@briantylercohen Things have flattened out as far as unemployment and jobs and the stock market.

The rising interest rates and rising cost of fuel and supplies could really do some damage to a teetering economy.",,[3]
RichardElm,"@CheriJacobus @FeasterFamine None the less, he wants a separate, ""bilgy"" parade with tanks and missiles that will cost taxpayers. 
And then, the roads will need to be repaired due to damage done by heavy artillery rolling down the streets. Another cost to tax payers.",,[3]
hamiltonsglobal,RT @jameshurley: Great interview with Paul Clark by @Channel4News showing the human cost of GRG's callousness. I've met so many business ow…,Great interview with Paul Clark by @Channel4News showing the human cost of GRG's callousness. I've met so many business owners over the last five years who will empathise. Makes a mockery of regulatory system that RBS will get away with all this damage without punishment. https://t.co/GGqowVyW8N,[3]
Carbon_Response,"Today's Global Carbon Loss Index (CLIX) is 14.70 USD/tonne CO2. CLIX carbon pricing factors in the true cost of damage caused by CO2 emissions – past, present and future.
https://t.co/ELOB6DvLnh",,[3]
MustufaNSUI,"RT @RahulGandhi: The opportunistic BJP-PDP alliance set fire to J&amp;K, killing many innocent people including our brave soldiers. It cost Ind…","The opportunistic BJP-PDP alliance set fire to J&amp;K, killing many innocent people including our brave soldiers. It cost India strategically &amp;  destroyed years of UPA’s hard  work. The damage will continue under President’s rule. Incompetence, arrogance &amp; hatred always fails.",[3]
AndrewMorganRCT,"@CaswellAlun @SWPCynon Agree, I’ve never know the level of complaints and damage locally. Brand new play areas damaged and public buildings have been damaged too, All a cost to tax payers of RCT!",,[3]
PCInsuranceSvcs,"Weather disasters, fire damage, and vandalism can cost you thousands of dollars! Ask about disaster coverage. https://t.co/1YTjHKQyrR https://t.co/xzrJVfo2jq",,[3]
EllaStarts,"@MichelleRempel Is there not a legal way Canada can relieve Trudeau of his duties now? It's about damage control. We all know the liberals are destroying Canada. Can we not pay him out and call an election? Start a GO Fund Me page to fundraise his severance pay, with no cost to CDN taxpayers.",,[3]
barbfriedberg,You must read my 'tell all' investing story @GoBankingRates about how fear hurt my net worth &amp; cost me thousands of dollars. Fear Punished My Net Worth — Don't Let It Damage Yours https://t.co/krAwD1xVV3 #investing #PersonalFinance #Secrets #SmartMoneySquad Please RT https://t.co/XALQHskkgS,,[3]
maluspuella,i solely use it to boost damage on bad melee weapons while leveling. removing the energy cost helps but i just don't personally use it.,,[3]
NikkoGuy,"cell having a ton of options is fine but options should come at the cost of damage

ie. gotenks, majin buu, etc",,[3]
Faytte,Finally Source Skills: Daggers Drawn is not as good as Onslaught despite having less range cause daggers. Fan of Knives cost a source point to do less damage than Whirlwind (no source point) with slightly more range. Overpower is WAY stronger than Mortal Blow: destroy all armor.,,[3]
JohnDer72780965,@AllenJordanLV Automakers were OK with Obama’s scheduled standards. Some foreign vehicles already exceed them. There is no logical reason to postpone them other than trump’s obsession with undoing Obama’s legacy whatever the cost. It will take years to undo the damage trump has already caused.,,[3]
shakeelshafiqu1,RT @CastrolArabia: تجاهل تغيير الزيت يصعب عمل المحرك. ويقود ذلك لاحقاً إلى ارتفاع درجة حرارة المحرك وحدوث تلف هائل، وبالتالي تحمل خسائر كبي…,"تجاهل تغيير الزيت يصعب عمل المحرك. ويقود ذلك لاحقاً إلى ارتفاع درجة حرارة المحرك وحدوث تلف هائل، وبالتالي تحمل خسائر كبيرة #نصيحة_كاسترول

Ignoring oil change forces your engine to work harder. Eventually, it will overheat, suffer severe damage &amp; cost you a lot #CastrolTip https://t.co/8fq16aGlii",[3]
GaryDelaney,It’s estimated the cost of the damage could be in the hundreds and thousands. https://t.co/4x5ALUOI9u,,[3]
tesria,"@hxmuel @andigalpern @NotDonnaBrazile @MaplesonF @1azylizzie The apple cables often still work, but further damage becomes really easy at that point. Plus god forbid you have a pet. I can buy a *set* of decent replacement cables for less than the cost of *one* Apple cable. It's ridiculous.",,[3]
globalissuesweb,Newsweek: Ukraine wants to bill Russia for war damage and it could cost billions https://t.co/hFSHiLE6fp https://t.co/OEgZOcIxQe,,[3]
maidenvoyageccg,RT @maidenvoyageccg: FAUSTUS COMPENDIUM /// Click here to check out this ominous grimoire found in the Warlock deck. When a Witch activates…,"FAUSTUS COMPENDIUM /// Click here to check out this ominous grimoire found in the Warlock deck. When a Witch activates this grimoire she can enhance the damage output of an allied Witch &amp; ensure the damage is completely unabsorbable. Surely, this kind of power comes at a cost. https://t.co/eeI1spDax5",[3]
WrightGpeter,"@RoryStewartUK @offender_mgmt Politicians have long blown hot and cold about prison. You clearly recognise its cost, its limitations, and the damage it can cause, but as soon as a high profile offence occurs or the media shouts (risking political unpopularity for being soft on crime) it's ""lock them up"".",,[3]
DevinJamaal_,"@EAMaddenNFL @KSTiLLS Also I’ve been made aware, which I’m sure you knew would come out, that you did the same thing to him last year. What type of people do you employ that make the same mistakes twice? That can’t be cost effective. Maybe you should hire Colin to be head of risk and damage control.",,[3]
JaniceMarschner,"RT @flee8573: @USSCobblerguy @NathanHRubin Mom had a stroke in Montreal, rushed to ER, it saved her life. Months of rehab, never saw a bill…","@USSCobblerguy @NathanHRubin Mom had a stroke in Montreal, rushed to ER, it saved her life. Months of rehab, never saw a bill. Her sister also had a stroke in Arizona last year, didn’t make it to ER fast enough cause her husband was afraid of cost, now has permanent brain damage + $35k debt.",[3]
EUwatchers,Voices from #Ukraine : Newsweek: Ukraine wants to bill Russia for war damage and it could cost billions https://t.co/86UFEmeHmg,,[3]
1PercenterSimon,"@VueHelp At least that way I can make a difference and hopefully no more injuries or damage to property which customers have to shoulder the cost for. At the end of the day, after Monday your cinema will lose my business for about 6 months which also means my friends who come with me",,[3]
A_Dilettante_,"One major surgery can cost $30,000. Breaking your leg can take two or three surgeries depending on how bad the damage is. Y’all taking $90,000 in surgeries on the chin? I doubt it.",,[3]
wayward710,RT @SarahJamieLewis: Hell the whole point of [actual] security engineering is you assume you are going to get hacked at some point in time…,"Hell the whole point of [actual] security engineering is you assume you are going to get hacked at some point in time and you design the system in such a way that the damage, at each point is minimized, that recovery is quick, and that the risk is acceptably balanced with cost",[3]
